amerikkalaistuen	a m e r i k k a l a i s t u e n
kitketä	k i t k e t ä
aallonharjassa	a a l l o n h a r j a s s a
lietelantala	l i e t e l a n t a l a
ongelmina	o n g e l m i n a
hallitusmielisesti	h a l l i t u s m i e l i s e s t i
kivelle	k i v e l l e
näytteistys	n ä y t t e i s t y s
parikuinen	p a r i k u i n e n
skinkki	s k i n k k i
pingottaminen	p i n g o t t a m i n e n
degeneraatioaste	d e g e n e r a a t i o a s t e
funtsin	f u n t s i n
hoetulla	h o e t u l l a
terävästi	t e r ä v ä s t i
piilukkopyssy	p i i l u k k o p y s s y
kaveruus	k a v e r u u s
ölinä	ö l i n ä
utopistiset	u t o p i s t i s e t
jäljentyy	j ä l j e n t y y
edustuskelpoinen	e d u s t u s k e l p o i n e n
atk-järjestelmä	a t k - j ä r j e s t e l m ä
tapainkuvaus	t a p a i n k u v a u s
musiikkianalyysi	m u s i i k k i a n a l y y s i
antifoni	a n t i f o n i
tamman	t a m m a n
ajatollahin	a j a t o l l a h i n
älyllistymme	ä l y l l i s t y m m e
aurinkovoimalaitos	a u r i n k o v o i m a l a i t o s
immin	i m m i n
ukonkeltano	u k o n k e l t a n o
kreppaus	k r e p p a u s
portsariraha	p o r t s a r i r a h a
sineiltä	s i n e i l t ä
pörrössä	p ö r r ö s s ä
sielutiede	s i e l u t i e d e
nuta	n u t a
Malinen	M a l i n e n
ylittäjän	y l i t t ä j ä n
pikkiriikkinen	p i k k i r i i k k i n e n
poikamainen	p o i k a m a i n e n
tyrmäystippa	t y r m ä y s t i p p a
penkkihiomakone	p e n k k i h i o m a k o n e
mystikko	m y s t i k k o
kuusettuminen	k u u s e t t u m i n e n
kosteuseristys	k o s t e u s e r i s t y s
hirttoköysi	h i r t t o k ö y s i
paraguaynvyötiäinen	p a r a g u a y n v y ö t i ä i n e n
lehminavetta	l e h m i n a v e t t a
moukkamaisuus	m o u k k a m a i s u u s
nukke-elokuva	n u k k e - e l o k u v a
henkilöturvatunnus	h e n k i l ö t u r v a t u n n u s
hopeatupsusilkkiapina	h o p e a t u p s u s i l k k i a p i n a
tekoäly	t e k o ä l y
yhteisvastuullinen	y h t e i s v a s t u u l l i n e n
omenavarkaissa	o m e n a v a r k a i s s a
karukko	k a r u k k o
tehtyjen	t e h t y j e n
kaihoisan	k a i h o i s a n
aamutohveli	a a m u t o h v e l i
miestenhaku	m i e s t e n h a k u
ajospahka	a j o s p a h k a
einesteollisuus	e i n e s t e o l l i s u u s
paisuvainen	p a i s u v a i n e n
hyöri	h y ö r i
ankkuroiduttane	a n k k u r o i d u t t a n e
ampumaleiri	a m p u m a l e i r i
kukka-aiheinen	k u k k a - a i h e i n e n
suuditsevat	s u u d i t s e v a t
aitokoon	a i t o k o o n
määristä	m ä ä r i s t ä
gekon	g e k o n
immyttä	i m m y t t ä
materialisoitua	m a t e r i a l i s o i t u a
verille	v e r i l l e
mesikät	m e s i k ä t
pikkuakseli	p i k k u a k s e l i
taputtaminen	t a p u t t a m i n e n
tupehtua	t u p e h t u a
rapina	r a p i n a
ripun	r i p u n
neliniitinen	n e l i n i i t i n e n
oriita	o r i i t a
vapaaottelija	v a p a a o t t e l i j a
sikkaraa	s i k k a r a a
opetusharjoittelija	o p e t u s h a r j o i t t e l i j a
perunamämmi	p e r u n a m ä m m i
absurdin	a b s u r d i n
veneranta	v e n e r a n t a
tesselaatio	t e s s e l a a t i o
lämmittelybändi	l ä m m i t t e l y b ä n d i
polvijärveläinen	p o l v i j ä r v e l ä i n e n
virtsaamisvaikeus	v i r t s a a m i s v a i k e u s
jänishousu	j ä n i s h o u s u
uimapuku	u i m a p u k u
aktualisoituisivat	a k t u a l i s o i t u i s i v a t
koholle	k o h o l l e
sujauttaa	s u j a u t t a a
silmämuna	s i l m ä m u n a
ahdasmielisesti	a h d a s m i e l i s e s t i
edistyksen	e d i s t y k s e n
lehtomaa	l e h t o m a a
kaupunkirakennus	k a u p u n k i r a k e n n u s
valkokuonovalas	v a l k o k u o n o v a l a s
lastaan	l a s t a a n
sannoitus	s a n n o i t u s
soreus	s o r e u s
vanhentaa	v a n h e n t a a
luontevuus	l u o n t e v u u s
sohva	s o h v a
jokikilpikonna	j o k i k i l p i k o n n a
nelinkertaisesti	n e l i n k e r t a i s e s t i
pääseminen	p ä ä s e m i n e n
tavoitehinta	t a v o i t e h i n t a
tsupukka	t s u p u k k a
puuhakkuus	p u u h a k k u u s
kanneltaja	k a n n e l t a j a
pepuista	p e p u i s t a
trokaus	t r o k a u s
ystävystyttäessä	y s t ä v y s t y t t ä e s s ä
seinemmäksi	s e i n e m m ä k s i
siemenvuosi	s i e m e n v u o s i
loveus	l o v e u s
täyteläinen	t ä y t e l ä i n e n
filmifestivaali	f i l m i f e s t i v a a l i
yläilmat	y l ä i l m a t
häpeissäsi	h ä p e i s s ä s i
rivimies	r i v i m i e s
taonnainen	t a o n n a i n e n
muotosarja	m u o t o s a r j a
arosusi	a r o s u s i
mieskvartetti	m i e s k v a r t e t t i
kokoontumislaki	k o k o o n t u m i s l a k i
ansioeläke	a n s i o e l ä k e
styreenioksidi	s t y r e e n i o k s i d i
kuloa	k u l o a
latvaan	l a t v a a n
hontelo	h o n t e l o
mehujääpuikko	m e h u j ä ä p u i k k o
työntö	t y ö n t ö
denimiksi	d e n i m i k s i
gustatorinen	g u s t a t o r i n e n
ensiviulisti	e n s i v i u l i s t i
astiastot	a s t i a s t o t
persilja	p e r s i l j a
italianvinttikoira	i t a l i a n v i n t t i k o i r a
tarhaa	t a r h a a
rajaaminen	r a j a a m i n e n
pamautus	p a m a u t u s
hyppylanka	h y p p y l a n k a
videopuhelin	v i d e o p u h e l i n
koekäyttö	k o e k ä y t t ö
revolutionismi	r e v o l u t i o n i s m i
talouksiksi	t a l o u k s i k s i
gulassin	g u l a s s i n
karrieerinainen	k a r r i e e r i n a i n e n
nuolelta	n u o l e l t a
yksituumaisesti	y k s i t u u m a i s e s t i
bruttokasvu	b r u t t o k a s v u
askeetit	a s k e e t i t
nikotinisti	n i k o t i n i s t i
pelkkä	p e l k k ä
omavaraistan	o m a v a r a i s t a n
mehiläispako	m e h i l ä i s p a k o
valtakunnansyyttäjävirasto	v a l t a k u n n a n s y y t t ä j ä v i r a s t o
bennettinpuukenguruja	b e n n e t t i n p u u k e n g u r u j a
ratkaistaan	r a t k a i s t a a n
hugenotin	h u g e n o t i n
hoitokoteja	h o i t o k o t e j a
kuvankaunis	k u v a n k a u n i s
kasissa	k a s i s s a
kalanviljely	k a l a n v i l j e l y
verholla	v e r h o l l a
äkseerata	ä k s e e r a t a
kreatiniini	k r e a t i n i i n i
märkämätä	m ä r k ä m ä t ä
heittokehä	h e i t t o k e h ä
saareksi	s a a r e k s i
lököttää	l ö k ö t t ä ä
rasitussairaus	r a s i t u s s a i r a u s
käristyi	k ä r i s t y i
lempiartisti	l e m p i a r t i s t i
polysakkaridi	p o l y s a k k a r i d i
faustinen	f a u s t i n e n
matossa	m a t o s s a
hämmennellä	h ä m m e n n e l l ä
hakemattomalle	h a k e m a t t o m a l l e
erilaissekovartisuus	e r i l a i s s e k o v a r t i s u u s
epäpätevä	e p ä p ä t e v ä
desimaalinen	d e s i m a a l i n e n
epileptikon	e p i l e p t i k o n
saatoin	s a a t o i n
siedettävän	s i e d e t t ä v ä n
sivuikkuna	s i v u i k k u n a
paholaismainen	p a h o l a i s m a i n e n
umpikänninen	u m p i k ä n n i n e n
ajettuessa	a j e t t u e s s a
poskista	p o s k i s t a
opettajanvirka	o p e t t a j a n v i r k a
kapinan	k a p i n a n
haaveri	h a a v e r i
herttavitonen	h e r t t a v i t o n e n
lauantaiseksi	l a u a n t a i s e k s i
ulottuvissa	u l o t t u v i s s a
iriitti	i r i i t t i
näännytys	n ä ä n n y t y s
korvasienikeitto	k o r v a s i e n i k e i t t o
tärkeys	t ä r k e y s
Valde	V a l d e
putosin	p u t o s i n
kymmenottelu	k y m m e n o t t e l u
perusteellinen	p e r u s t e e l l i n e n
kihveli	k i h v e l i
välitön	v ä l i t ö n
astella	a s t e l l a
seinäkalenteri	s e i n ä k a l e n t e r i
imelyys	i m e l y y s
syrjäpolku	s y r j ä p o l k u
päivätuotanto	p ä i v ä t u o t a n t o
tyrskeet	t y r s k e e t
maisema-arkkitehti	m a i s e m a - a r k k i t e h t i
murreaineisto	m u r r e a i n e i s t o
kierreharja	k i e r r e h a r j a
nivelikkään	n i v e l i k k ä ä n
politisoi	p o l i t i s o i
kolmijalka	k o l m i j a l k a
asuinrakennus	a s u i n r a k e n n u s
froteekankaat	f r o t e e k a n k a a t
Balkania	B a l k a n i a
stokastinen	s t o k a s t i n e n
pohjanlumme	p o h j a n l u m m e
juuttimatto	j u u t t i m a t t o
vokaalien	v o k a a l i e n
ikonimaalari	i k o n i m a a l a r i
toppaus	t o p p a u s
riitelijän	r i i t e l i j ä n
adaptoitumalla	a d a p t o i t u m a l l a
kotirouva	k o t i r o u v a
lahtivalas	l a h t i v a l a s
omeletti	o m e l e t t i
oppimiskyky	o p p i m i s k y k y
skinit	s k i n i t
lerppahattu	l e r p p a h a t t u
työttömyysturva	t y ö t t ö m y y s t u r v a
salavihkaisesti	s a l a v i h k a i s e s t i
froteet	f r o t e e t
haasteen	h a a s t e e n
ääntää	ä ä n t ä ä
konnektionismi	k o n n e k t i o n i s m i
elinvuosi	e l i n v u o s i
kolmivyötylli	k o l m i v y ö t y l l i
aakkostuksia	a a k k o s t u k s i a
himalajanviiruoravat	h i m a l a j a n v i i r u o r a v a t
simsalabim	s i m s a l a b i m
sähköajanotto	s ä h k ö a j a n o t t o
kahdeksasosanuotti	k a h d e k s a s o s a n u o t t i
seisty	s e i s t y
multain	m u l t a i n
tauti	t a u t i
kaksikyttyräinen	k a k s i k y t t y r ä i n e n
bitumisora	b i t u m i s o r a
edistyttäneen	e d i s t y t t ä n e e n
skintillaatio	s k i n t i l l a a t i o
hajanaisuuden	h a j a n a i s u u d e n
kinut	k i n u t
stökiometria	s t ö k i o m e t r i a
muuntokoulutus	m u u n t o k o u l u t u s
ahavoitunen	a h a v o i t u n e n
töllistää	t ö l l i s t ä ä
antibiootit	a n t i b i o o t i t
kirkottaa	k i r k o t t a a
jalkajakkara	j a l k a j a k k a r a
arvio	a r v i o
mölli	m ö l l i
ristipölytys	r i s t i p ö l y t y s
pienikokoinen	p i e n i k o k o i n e n
nyyhkeet	n y y h k e e t
purskauttaa	p u r s k a u t t a a
juche-aate	j u c h e - a a t e
aerobinen	a e r o b i n e n
pakkolomautus	p a k k o l o m a u t u s
yliopisto-opiskelija	y l i o p i s t o - o p i s k e l i j a
elukoitten	e l u k o i t t e n
diversifioiduit	d i v e r s i f i o i d u i t
ärsyttykööt	ä r s y t t y k ö ö t
DDR:ksi	D D R : k s i
järkyttää	j ä r k y t t ä ä
kaksintaistelu	k a k s i n t a i s t e l u
rintaa	r i n t a a
sekoilla	s e k o i l l a
suostui	s u o s t u i
arbuusin	a r b u u s i n
terveydenhuoltopalvelu	t e r v e y d e n h u o l t o p a l v e l u
tuulenpuuska	t u u l e n p u u s k a
avioitunevat	a v i o i t u n e v a t
sähköpaistinpannu	s ä h k ö p a i s t i n p a n n u
irstaat	i r s t a a t
närhiin	n ä r h i i n
värivoide	v ä r i v o i d e
nenäkarhu	n e n ä k a r h u
kustannustehokkuus	k u s t a n n u s t e h o k k u u s
paskoina	p a s k o i n a
kuulle	k u u l l e
stressata	s t r e s s a t a
skandinavismi	s k a n d i n a v i s m i
tariffoida	t a r i f f o i d a
valoelin	v a l o e l i n
rajoitatte	r a j o i t a t t e
piuhan	p i u h a n
otsapenger	o t s a p e n g e r
eksoskeleton	e k s o s k e l e t o n
elektroniikkakomponentti	e l e k t r o n i i k k a k o m p o n e n t t i
isonee	i s o n e e
tiiviimpään	t i i v i i m p ä ä n
hajunpoistoaine	h a j u n p o i s t o a i n e
engrammi	e n g r a m m i
lämmittimet	l ä m m i t t i m e t
anonee	a n o n e e
käyntilämpötila	k ä y n t i l ä m p ö t i l a
päävoitto	p ä ä v o i t t o
elehtivät	e l e h t i v ä t
liberaalisuus	l i b e r a a l i s u u s
männyllä	m ä n n y l l ä
siivet	s i i v e t
mäet	m ä e t
palvelumuoto	p a l v e l u m u o t o
kaasukahva	k a a s u k a h v a
tuohien	t u o h i e n
kahdeksanneksi	k a h d e k s a n n e k s i
kuori	k u o r i
palvelukeskus	p a l v e l u k e s k u s
väät	v ä ä t
asiointikieli	a s i o i n t i k i e l i
arkaluontoinen	a r k a l u o n t o i n e n
ohuke	o h u k e
orsina	o r s i n a
kotiseuduntutkimus	k o t i s e u d u n t u t k i m u s
liedeltä	l i e d e l t ä
emansipoitunut	e m a n s i p o i t u n u t
lähiosoite	l ä h i o s o i t e
synnytinelimet	s y n n y t i n e l i m e t
keskitiheys	k e s k i t i h e y s
karhilta	k a r h i l t a
perälle	p e r ä l l e
natsi	n a t s i
suojalevy	s u o j a l e v y
perune	p e r u n e
stereofonia	s t e r e o f o n i a
hitautta	h i t a u t t a
minuun	m i n u u n
mekatroniikka	m e k a t r o n i i k k a
rita	r i t a
perustustyön	p e r u s t u s t y ö n
lukunopeus	l u k u n o p e u s
huntukielto	h u n t u k i e l t o
ajonopeus	a j o n o p e u s
niisipälkki	n i i s i p ä l k k i
petoankerias	p e t o a n k e r i a s
Skotlantia	S k o t l a n t i a
surahdella	s u r a h d e l l a
korvallinen	k o r v a l l i n e n
jompanakumpana	j o m p a n a k u m p a n a
jatkuvan	j a t k u v a n
puoliturkki	p u o l i t u r k k i
määriin	m ä ä r i i n
lingvisti	l i n g v i s t i
alivalotuin	a l i v a l o t u i n
typösen	t y p ö s e n
kombinoitui	k o m b i n o i t u i
farkkupusakka	f a r k k u p u s a k k a
puhetapa	p u h e t a p a
matkustaa	m a t k u s t a a
perheenisä	p e r h e e n i s ä
sovitus	s o v i t u s
päätti	p ä ä t t i
mummi	m u m m i
kesto	k e s t o
vasta	v a s t a
lähin	l ä h i n
eli	e l i
toisessa	t o i s e s s a
keksitty	k e k s i t t y
ylimääräistä	y l i m ä ä r ä i s t ä
nimeltään	n i m e l t ä ä n
koneessa	k o n e e s s a
osavuosikatsaus	o s a v u o s i k a t s a u s
monille	m o n i l l e
pidempi	p i d e m p i
pidetty	p i d e t t y
ovat	o v a t
myöskin	m y ö s k i n
kokivat	k o k i v a t
päähenkilö	p ä ä h e n k i l ö
tuonne	t u o n n e
tasapainoon	t a s a p a i n o o n
pienelle	p i e n e l l e
kumouksellinen	k u m o u k s e l l i n e n
kymmenkunta	k y m m e n k u n t a
nuoruusajan	n u o r u u s a j a n
talvella	t a l v e l l a
ominaisuudet	o m i n a i s u u d e t
kuuhun	k u u h u n
ruokavaliota	r u o k a v a l i o t a
alueesta	a l u e e s t a
viittaa	v i i t t a a
syön	s y ö n
tämän	t ä m ä n
Viro	V i r o
valitse	v a l i t s e
välissä	v ä l i s s ä
patsas	p a t s a s
violetti	v i o l e t t i
nikaman	n i k a m a n
saatavaa	s a a t a v a a
näppäimistö	n ä p p ä i m i s t ö
myynnin	m y y n n i n
Kristian	K r i s t i a n
tervapääsky	t e r v a p ä ä s k y
ammuttiin	a m m u t t i i n
finaali	f i n a a l i
mistä	m i s t ä
mitään	m i t ä ä n
rahankäyttö	r a h a n k ä y t t ö
sellainen	s e l l a i n e n
ammatillinen	a m m a t i l l i n e n
ymmärrän	y m m ä r r ä n
jonain	j o n a i n
kirjattu	k i r j a t t u
esiin	e s i i n
katselee	k a t s e l e e
Markku	M a r k k u
keskiarvoon	k e s k i a r v o o n
pitävät	p i t ä v ä t
puhaltaa	p u h a l t a a
tehnyt	t e h n y t
Osmo	O s m o
vastavuoroisesti	v a s t a v u o r o i s e s t i
sankarin	s a n k a r i n
saa	s a a
oppositiopuolue	o p p o s i t i o p u o l u e
Pariisi	P a r i i s i
lihan	l i h a n
Varsinais-Suomi	V a r s i n a i s - S u o m i
loppu	l o p p u
vaikutus	v a i k u t u s
ohueen	o h u e e n
seikka	s e i k k a
pohtii	p o h t i i
kaista	k a i s t a
asukkaat	a s u k k a a t
muisto	m u i s t o
seitsemänneksi	s e i t s e m ä n n e k s i
Marja	M a r j a
ohjelmat	o h j e l m a t
oliiviöljy	o l i i v i ö l j y
syntyä	s y n t y ä
muuttanut	m u u t t a n u t
suola	s u o l a
elokuviin	e l o k u v i i n
eli	e l i
lapsi	l a p s i
eli	e l i
mulle	m u l l e
värejä	v ä r e j ä
juurikin	j u u r i k i n
vaiheet	v a i h e e t
jolloin	j o l l o i n
lehti	l e h t i
kulkevat	k u l k e v a t
Matti	M a t t i
seurakuntatalo	s e u r a k u n t a t a l o
kulttuuritapahtuma	k u l t t u u r i t a p a h t u m a
pelasti	p e l a s t i
ovat	o v a t
saattanut	s a a t t a n u t
yläpuolella	y l ä p u o l e l l a
siihen	s i i h e n
edellytys	e d e l l y t y s
lauma	l a u m a
puun	p u u n
lakkoon	l a k k o o n
näistä	n ä i s t ä
ollut	o l l u t
ovat	o v a t
seitsemän	s e i t s e m ä n
ammattilainen	a m m a t t i l a i n e n
talossa	t a l o s s a
suhde	s u h d e
kutsuin	k u t s u i n
mikrossa	m i k r o s s a
kauniit	k a u n i i t
valmistella	v a l m i s t e l l a
hengittävä	h e n g i t t ä v ä
laatua	l a a t u a
ovat	o v a t
kuitenkin	k u i t e n k i n
käsikirja	k ä s i k i r j a
jatkuva	j a t k u v a
paavi	p a a v i
vähän	v ä h ä n
käytössä	k ä y t ö s s ä
maksaa	m a k s a a
henkilön	h e n k i l ö n
saa	s a a
entistä	e n t i s t ä
hyödyllinen	h y ö d y l l i n e n
muun	m u u n
varren	v a r r e n
tytön	t y t ö n
Mette	M e t t e
niinpä	n i i n p ä
pienissä	p i e n i s s ä
perustaa	p e r u s t a a
suunniteltu	s u u n n i t e l t u
pidot	p i d o t
koominen	k o o m i n e n
hinta	h i n t a
korkein	k o r k e i n
lattian	l a t t i a n
marraskuu	m a r r a s k u u
vähetä	v ä h e t ä
soittaja	s o i t t a j a
puskuri	p u s k u r i
aloittaa	a l o i t t a a
tämän	t ä m ä n
euron	e u r o n
ollut	o l l u t
alati	a l a t i
kronologisesti	k r o n o l o g i s e s t i
isompi	i s o m p i
kurssi	k u r s s i
ollut	o l l u t
ry	r y
lahjoja	l a h j o j a
yllättävän	y l l ä t t ä v ä n
seuraa	s e u r a a
mukaan	m u k a a n
Eurooppa	E u r o o p p a
töihin	t ö i h i n
mukaan	m u k a a n
majoitus	m a j o i t u s
Ranska	R a n s k a
uusimmat	u u s i m m a t
siihen	s i i h e n
vasen	v a s e n
viikon	v i i k o n
Viron	V i r o n
kertovat	k e r t o v a t
kuitenkin	k u i t e n k i n
tuntia	t u n t i a
tekemässä	t e k e m ä s s ä
alkuperäinen	a l k u p e r ä i n e n
joulukuun	j o u l u k u u n
lopettamaan	l o p e t t a m a a n
väärä	v ä ä r ä
joten	j o t e n
edistäminen	e d i s t ä m i n e n
norjalainen	n o r j a l a i n e n
kunnille	k u n n i l l e
ministeri	m i n i s t e r i
Englannin	E n g l a n n i n
mukaan	m u k a a n
kitara	k i t a r a
sydämistä	s y d ä m i s t ä
nähdä	n ä h d ä
henkilön	h e n k i l ö n
etuna	e t u n a
valittava	v a l i t t a v a
lumet	l u m e t
lähdimme	l ä h d i m m e
jäähyväiset	j ä ä h y v ä i s e t
soittimet	s o i t t i m e t
enimmäismäärä	e n i m m ä i s m ä ä r ä
fiktiivinen	f i k t i i v i n e n
saa	s a a
sopimukset	s o p i m u k s e t
juoma	j u o m a
yrittänyt	y r i t t ä n y t
työaika	t y ö a i k a
jokaisen	j o k a i s e n
tuollainen	t u o l l a i n e n
eväät	e v ä ä t
asianajaja	a s i a n a j a j a
Matti	M a t t i
pyörätie	p y ö r ä t i e
kuitenkin	k u i t e n k i n
lentokoneessa	l e n t o k o n e e s s a
tavalla	t a v a l l a
katettu	k a t e t t u
bittinen	b i t t i n e n
harva	h a r v a
nokea	n o k e a
iltoihin	i l t o i h i n
ollut	o l l u t
kuitenkin	k u i t e n k i n
ehdoton	e h d o t o n
virallisesti	v i r a l l i s e s t i
erottautuminen	e r o t t a u t u m i n e n
termi	t e r m i
puristaa	p u r i s t a a
tilalla	t i l a l l a
toivoen	t o i v o e n
hallitseva	h a l l i t s e v a
tulevaan	t u l e v a a n
sintteri	s i n t t e r i
välin	v ä l i n
hytti	h y t t i
syömään	s y ö m ä ä n
kotoisin	k o t o i s i n
kuivana	k u i v a n a
sanoa	s a n o a
pihan	p i h a n
pääty	p ä ä t y
jälkeen	j ä l k e e n
työryhmä	t y ö r y h m ä
bileiden	b i l e i d e n
kirjainta	k i r j a i n t a
pino	p i n o
suruviesti	s u r u v i e s t i
taskuun	t a s k u u n
lehti	l e h t i
myrkytys	m y r k y t y s
pelaajan	p e l a a j a n
päin	p ä i n
vanhin	v a n h i n
olisimme	o l i s i m m e
teettää	t e e t t ä ä
osta	o s t a
omille	o m i l l e
Ilves	I l v e s
toim.	t o i m .
korjataan	k o r j a t a a n
tähteitä	t ä h t e i t ä
lomaan	l o m a a n
kehotti	k e h o t t i
tien	t i e n
täyden	t ä y d e n
lavalle	l a v a l l e
sanat	s a n a t
kisassa	k i s a s s a
hoitavat	h o i t a v a t
haluavat	h a l u a v a t
työryhmä	t y ö r y h m ä
sille	s i l l e
näyttö	n ä y t t ö
kiilui	k i i l u i
kertovat	k e r t o v a t
alueilla	a l u e i l l a
yhteyden	y h t e y d e n
hartaasti	h a r t a a s t i
tämä	t ä m ä
sille	s i l l e
sattui	s a t t u i
esteettisesti	e s t e e t t i s e s t i
nyt	n y t
paljastavat	p a l j a s t a v a t
vähäinen	v ä h ä i n e n
kootut	k o o t u t
työtä	t y ö t ä
arvostelu	a r v o s t e l u
johti	j o h t i
ruoka	r u o k a
aukot	a u k o t
nimettömästi	n i m e t t ö m ä s t i
käsittelevä	k ä s i t t e l e v ä
näkyä	n ä k y ä
vasta	v a s t a
ovat	o v a t
tämä	t ä m ä
kokous	k o k o u s
kuitenkin	k u i t e n k i n
työvoimakoulutus	t y ö v o i m a k o u l u t u s
kytkin	k y t k i n
tietä	t i e t ä
kestävät	k e s t ä v ä t
laita	l a i t a
hätään	h ä t ä ä n
verkkokalastus	v e r k k o k a l a s t u s
loi	l o i
koittanut	k o i t t a n u t
valuutan	v a l u u t a n
tapauksissa	t a p a u k s i s s a
vanteen	v a n t e e n
vaatteet	v a a t t e e t
hinnoittelu	h i n n o i t t e l u
hinnasta	h i n n a s t a
kirja	k i r j a
ovat	o v a t
maksuton	m a k s u t o n
näin	n ä i n
näistä	n ä i s t ä
mittaan	m i t t a a n
palattiin	p a l a t t i i n
haluaa	h a l u a a
hallinto	h a l l i n t o
hänellä	h ä n e l l ä
henkilönostin	h e n k i l ö n o s t i n
tarkoitettua	t a r k o i t e t t u a
lähes	l ä h e s
joten	j o t e n
mulle	m u l l e
lukko	l u k k o
ympyrä	y m p y r ä
voimavarat	v o i m a v a r a t
improvisaation	i m p r o v i s a a t i o n
mistä	m i s t ä
kunnan	k u n n a n
haetaan	h a e t a a n
Ranska	R a n s k a
mukana	m u k a n a
Sirpa	S i r p a
maalilla	m a a l i l l a
hän	h ä n
viitata	v i i t a t a
enemmän	e n e m m ä n
tilannetta	t i l a n n e t t a
lämpökapasiteetti	l ä m p ö k a p a s i t e e t t i
koirat	k o i r a t
saataville	s a a t a v i l l e
antautuu	a n t a u t u u
ilmeisesti	i l m e i s e s t i
pohjalla	p o h j a l l a
eko	e k o
talous	t a l o u s
kysellään	k y s e l l ä ä n
sanottavaa	s a n o t t a v a a
antaa	a n t a a
lasku	l a s k u
suojata	s u o j a t a
arvostettu	a r v o s t e t t u
siihen	s i i h e n
työsuhdeauto	t y ö s u h d e a u t o
ovat	o v a t
tinkiä	t i n k i ä
myynyt	m y y n y t
monilla	m o n i l l a
toimitettu	t o i m i t e t t u
lehti	l e h t i
asunto-osake	a s u n t o - o s a k e
häpeää	h ä p e ä ä
Pihla	P i h l a
jolloin	j o l l o i n
Raasepori	R a a s e p o r i
loinen	l o i n e n
määrätä	m ä ä r ä t ä
hiukkasen	h i u k k a s e n
arvot	a r v o t
kilpirauhasen	k i l p i r a u h a s e n
hyödyllinen	h y ö d y l l i n e n
artikla	a r t i k l a
kertomus	k e r t o m u s
kuolleisuus	k u o l l e i s u u s
heitellä	h e i t e l l ä
mukaan	m u k a a n
hyvissä	h y v i s s ä
Somero	S o m e r o
piiloon	p i i l o o n
niitä	n i i t ä
shoppailu	s h o p p a i l u
viikon	v i i k o n
piilossa	p i i l o s s a
syntyy	s y n t y y
perheensä	p e r h e e n s ä
alueiden	a l u e i d e n
antaa	a n t a a
ensimmäistä	e n s i m m ä i s t ä
heinäkuuta	h e i n ä k u u t a
Touko	T o u k o
löytyvät	l ö y t y v ä t
ylioppilas	y l i o p p i l a s
asiakirjat	a s i a k i r j a t
matkat	m a t k a t
toiminta	t o i m i n t a
pelko	p e l k o
muiden	m u i d e n
juoksun	j u o k s u n
sellaiset	s e l l a i s e t
rakennuspaikka	r a k e n n u s p a i k k a
tilalle	t i l a l l e
niitä	n i i t ä
tarkka	t a r k k a
sidottu	s i d o t t u
Ilkka	I l k k a
joudut	j o u d u t
olimme	o l i m m e
euron	e u r o n
viimeisenä	v i i m e i s e n ä
ajankohta	a j a n k o h t a
tilasta	t i l a s t a
muuttanut	m u u t t a n u t
uutteet	u u t t e e t
kevyesti	k e v y e s t i
laajoja	l a a j o j a
kehystää	k e h y s t ä ä
Tarmo	T a r m o
kiinnostavaa	k i i n n o s t a v a a
joita	j o i t a
hän	h ä n
enää	e n ä ä
kestävä	k e s t ä v ä
kouluttautuminen	k o u l u t t a u t u m i n e n
kansainvälisiä	k a n s a i n v ä l i s i ä
muun	m u u n
Los	L o s
tietää	t i e t ä ä
pakastin	p a k a s t i n
paluuta	p a l u u t a
sidoksissa	s i d o k s i s s a
luokka	l u o k k a
leikkaa	l e i k k a a
poskessa	p o s k e s s a
luonnosta	l u o n n o s t a
syytteet	s y y t t e e t
uutisoi	u u t i s o i
myymälä	m y y m ä l ä
kuitenkin	k u i t e n k i n
Facebookia	F a c e b o o k i a
projektioppiminen	p r o j e k t i o p p i m i n e n
onnistua	o n n i s t u a
ajankohtaista	a j a n k o h t a i s t a
ekologisesti	e k o l o g i s e s t i
perusteella	p e r u s t e e l l a
Eetu	E e t u
näyttävä	n ä y t t ä v ä
katkonainen	k a t k o n a i n e n
yrittämän	y r i t t ä m ä n
tarvitse	t a r v i t s e
mukaan	m u k a a n
rele	r e l e
esitellyn	e s i t e l l y n
normaali	n o r m a a l i
katoaminen	k a t o a m i n e n
pääpaino	p ä ä p a i n o
Mikkola	M i k k o l a
kovin	k o v i n
pankista	p a n k i s t a
kaupunki	k a u p u n k i
sääntöjen	s ä ä n t ö j e n
tämä	t ä m ä
rajoja	r a j o j a
eli	e l i
nyt	n y t
Pasi	P a s i
hahmo	h a h m o
automaatti	a u t o m a a t t i
päivinä	p ä i v i n ä
tavalla	t a v a l l a
puhu	p u h u
ovat	o v a t
heittää	h e i t t ä ä
toi	t o i
tilaaja	t i l a a j a
seikkailu	s e i k k a i l u
hankinta	h a n k i n t a
lukuisat	l u k u i s a t
Jeesuksen	J e e s u k s e n
myydä	m y y d ä
yhtenäinen	y h t e n ä i n e n
kaupoissa	k a u p o i s s a
laitteet	l a i t t e e t
surumielisesti	s u r u m i e l i s e s t i
ikä	i k ä
tuntia	t u n t i a
varma	v a r m a
ottamatta	o t t a m a t t a
myöhemmin	m y ö h e m m i n
Reijo	R e i j o
hinta	h i n t a
kaupunginvaltuusto	k a u p u n g i n v a l t u u s t o
hallinnolle	h a l l i n n o l l e
kielet	k i e l e t
ovat	o v a t
oikeita	o i k e i t a
ajatukselle	a j a t u k s e l l e
tämän	t ä m ä n
huomannut	h u o m a n n u t
mainonnan	m a i n o n n a n
päin	p ä i n
hidastuva	h i d a s t u v a
pihasta	p i h a s t a
perusteella	p e r u s t e e l l a
suihke	s u i h k e
ripuli	r i p u l i
mukaan	m u k a a n
tyydyttävä	t y y d y t t ä v ä
kannattavuus	k a n n a t t a v u u s
kynsilakan	k y n s i l a k a n
näköinen	n ä k ö i n e n
laidalla	l a i d a l l a
muunnos	m u u n n o s
toimeen	t o i m e e n
vuosipäivää	v u o s i p ä i v ä ä
nimensä	n i m e n s ä
lapsi	l a p s i
leijonankeltainen	l e i j o n a n k e l t a i n e n
tutkimus	t u t k i m u s
asetetaan	a s e t e t a a n
puinen	p u i n e n
omaksi	o m a k s i
yleisön	y l e i s ö n
runko	r u n k o
korjata	k o r j a t a
sänkyä	s ä n k y ä
säännöt	s ä ä n n ö t
kuitenkin	k u i t e n k i n
keinoin	k e i n o i n
hajusteen	h a j u s t e e n
hermoja	h e r m o j a
mukana	m u k a n a
opettajan	o p e t t a j a n
kuitenkin	k u i t e n k i n
brändin	b r ä n d i n
olette	o l e t t e
taistoon	t a i s t o o n
laivanrakennus	l a i v a n r a k e n n u s
sähköpostilaatikko	s ä h k ö p o s t i l a a t i k k o
Lassila	L a s s i l a
elinkeinoelämän	e l i n k e i n o e l ä m ä n
vähän	v ä h ä n
työssä	t y ö s s ä
suurimmat	s u u r i m m a t
asettui	a s e t t u i
kuoria	k u o r i a
tuulen	t u u l e n
niitä	n i i t ä
pienten	p i e n t e n
elokuusta	e l o k u u s t a
puute	p u u t e
erilaisia	e r i l a i s i a
