mannasaarni	m a n n a s a a r n i
asvaltti	a s v a l t t i
alennustila	a l e n n u s t i l a
fenomenologinen	f e n o m e n o l o g i n e n
hanurinsoittaja	h a n u r i n s o i t t a j a
kilpailuneuvosto	k i l p a i l u n e u v o s t o
laukaisualusta	l a u k a i s u a l u s t a
taustaan	t a u s t a a n
punon	p u n o n
ajattelemaan	a j a t t e l e m a a n
hirssiryyni	h i r s s i r y y n i
muhinointi	m u h i n o i n t i
antinne	a n t i n n e
yksittäisyyden	y k s i t t ä i s y y d e n
kulinaristi	k u l i n a r i s t i
nassakat	n a s s a k a t
kuntaa	k u n t a a
tännemmäksi	t ä n n e m m ä k s i
lysoli	l y s o l i
vakaumuksellisuus	v a k a u m u k s e l l i s u u s
maisterinsormus	m a i s t e r i n s o r m u s
öljylämmitys	ö l j y l ä m m i t y s
uskontojen	u s k o n t o j e n
päihdetyö	p ä i h d e t y ö
franseesin	f r a n s e e s i n
isodoggilepakko	i s o d o g g i l e p a k k o
lyhyiden	l y h y i d e n
eläköön	e l ä k ö ö n
kohonnevat	k o h o n n e v a t
vesibussi	v e s i b u s s i
demoduloida	d e m o d u l o i d a
ahdelauha	a h d e l a u h a
kiintyi	k i i n t y i
softaus	s o f t a u s
roseeviini	r o s e e v i i n i
apu	a p u
edustuttako	e d u s t u t t a k o
pilkoittaminen	p i l k o i t t a m i n e n
määräenemmistö	m ä ä r ä e n e m m i s t ö
kulmaviivoitin	k u l m a v i i v o i t i n
sairaalassa	s a i r a a l a s s a
näyttämömies	n ä y t t ä m ö m i e s
pölkyttää	p ö l k y t t ä ä
riekkokukko	r i e k k o k u k k o
astronomit	a s t r o n o m i t
sulatella	s u l a t e l l a
kaukalo	k a u k a l o
frontaalilohko	f r o n t a a l i l o h k o
omenankukkakärsäkäs	o m e n a n k u k k a k ä r s ä k ä s
estrogeeni	e s t r o g e e n i
hapsista	h a p s i s t a
bleiseri	b l e i s e r i
sanalippu	s a n a l i p p u
kellosignaali	k e l l o s i g n a a l i
sambaaja	s a m b a a j a
arkistoida	a r k i s t o i d a
maastopalo	m a a s t o p a l o
kaarat	k a a r a t
bensiiniltä	b e n s i i n i l t ä
putkirikko	p u t k i r i k k o
kumossa	k u m o s s a
maksusuoritus	m a k s u s u o r i t u s
ristijousi	r i s t i j o u s i
hydrofoni	h y d r o f o n i
alkusointu	a l k u s o i n t u
analyysitulos	a n a l y y s i t u l o s
-ksua	- k s u a
kioskiruoka	k i o s k i r u o k a
hernesääski	h e r n e s ä ä s k i
joutuin	j o u t u i n
hyviltä	h y v i l t ä
ensimmäisellä	e n s i m m ä i s e l l ä
olympiaedustus	o l y m p i a e d u s t u s
muikeasti	m u i k e a s t i
lorinan	l o r i n a n
rahalähde	r a h a l ä h d e
korkkijälsi	k o r k k i j ä l s i
Lauraasia	L a u r a a s i a
aktuaalistuttako	a k t u a a l i s t u t t a k o
sulatteet	s u l a t t e e t
pienoisralli	p i e n o i s r a l l i
vuoksille	v u o k s i l l e
lähtö	l ä h t ö
Helinä	H e l i n ä
hauessa	h a u e s s a
tarkoitukseton	t a r k o i t u k s e t o n
joukkojenhallinta	j o u k k o j e n h a l l i n t a
hietikkosara	h i e t i k k o s a r a
mieluummin	m i e l u u m m i n
laulukaskas	l a u l u k a s k a s
kunnallistiede	k u n n a l l i s t i e d e
sanastus	s a n a s t u s
putkihämähäkki	p u t k i h ä m ä h ä k k i
bongaukset	b o n g a u k s e t
kangastaa	k a n g a s t a a
murresanakirja	m u r r e s a n a k i r j a
kuvakieli	k u v a k i e l i
ihmeteko	i h m e t e k o
byrokratisoiduimme	b y r o k r a t i s o i d u i m m e
veneen	v e n e e n
tuhti	t u h t i
takalaiton	t a k a l a i t o n
mäiltä	m ä i l t ä
haitari	h a i t a r i
schwabenilainen	s c h w a b e n i l a i n e n
nöffi	n ö f f i
kapinallisilla	k a p i n a l l i s i l l a
koillispuoli	k o i l l i s p u o l i
vastikkeettomuus	v a s t i k k e e t t o m u u s
varastanut	v a r a s t a n u t
kaverisektoriin	k a v e r i s e k t o r i i n
veronpalautus	v e r o n p a l a u t u s
kivessä	k i v e s s ä
lamellikuljetin	l a m e l l i k u l j e t i n
armahtava	a r m a h t a v a
painovaatimukset	p a i n o v a a t i m u k s e t
suvien	s u v i e n
liikenteenohjaus	l i i k e n t e e n o h j a u s
savuisuus	s a v u i s u u s
moldavialainen	m o l d a v i a l a i n e n
polaroida	p o l a r o i d a
romantisoida	r o m a n t i s o i d a
puhdistamo	p u h d i s t a m o
satulakatto	s a t u l a k a t t o
riihelle	r i i h e l l e
keskitetty	k e s k i t e t t y
kortistoi	k o r t i s t o i
murskana	m u r s k a n a
tiskata	t i s k a t a
liekehdinnän	l i e k e h d i n n ä n
räpyttäminen	r ä p y t t ä m i n e n
epämuodollinen	e p ä m u o d o l l i n e n
ajanmukaistuimme	a j a n m u k a i s t u i m m e
äyrinmaa	ä y r i n m a a
vaalealahnanruoho	v a a l e a l a h n a n r u o h o
positiivisuus	p o s i t i i v i s u u s
luvattomuus	l u v a t t o m u u s
käsialatutkimus	k ä s i a l a t u t k i m u s
tarvitsette	t a r v i t s e t t e
byrokraattistutaan	b y r o k r a a t t i s t u t a a n
miksaus	m i k s a u s
säätiö	s ä ä t i ö
raketeille	r a k e t e i l l e
etuvartiokahakka	e t u v a r t i o k a h a k k a
aameineen	a a m e i n e e n
kaakkoisaasialainen	k a a k k o i s a a s i a l a i n e n
temporaalirakenne	t e m p o r a a l i r a k e n n e
estradin	e s t r a d i n
kehen	k e h e n
nimeämään	n i m e ä m ä ä n
koulupinnari	k o u l u p i n n a r i
akkautukoon	a k k a u t u k o o n
vapauksina	v a p a u k s i n a
vietteleminen	v i e t t e l e m i n e n
alistuta	a l i s t u t a
työnjohto-oikeus	t y ö n j o h t o - o i k e u s
sosiaalitoimisto	s o s i a a l i t o i m i s t o
näkösälle	n ä k ö s ä l l e
säästötalkoot	s ä ä s t ö t a l k o o t
siekaleelle	s i e k a l e e l l e
ähkin	ä h k i n
tuomella	t u o m e l l a
nukkekodein	n u k k e k o d e i n
panttilainauslaitos	p a n t t i l a i n a u s l a i t o s
arpinen	a r p i n e n
videokaappauskortti	v i d e o k a a p p a u s k o r t t i
neutralisoituu	n e u t r a l i s o i t u u
saammeko	s a a m m e k o
paatoksellisuus	p a a t o k s e l l i s u u s
kulkuyökkösen	k u l k u y ö k k ö s e n
tungen	t u n g e n
maitovalaat	m a i t o v a l a a t
kolmekulmainen	k o l m e k u l m a i n e n
mordvankielinen	m o r d v a n k i e l i n e n
kuvainpalvoja	k u v a i n p a l v o j a
pienoisrevolveri	p i e n o i s r e v o l v e r i
barokkiurku	b a r o k k i u r k u
lumisateita	l u m i s a t e i t a
tarranauhakiinnitys	t a r r a n a u h a k i i n n i t y s
naimme	n a i m m e
häärintä	h ä ä r i n t ä
kärpäsestä	k ä r p ä s e s t ä
telkeä	t e l k e ä
troopillinen	t r o o p i l l i n e n
pilviraja	p i l v i r a j a
kirjoittivat	k i r j o i t t i v a t
höllyys	h ö l l y y s
huojennus	h u o j e n n u s
lauhkealuonteinen	l a u h k e a l u o n t e i n e n
ruskonuppiseitikki	r u s k o n u p p i s e i t i k k i
haettavina	h a e t t a v i n a
kurottaa	k u r o t t a a
abstraktistuttane	a b s t r a k t i s t u t t a n e
avioiduitte	a v i o i d u i t t e
puolisotilaallinen	p u o l i s o t i l a a l l i n e n
matalikon	m a t a l i k o n
kaapinovi	k a a p i n o v i
auktoritatiivisesti	a u k t o r i t a t i i v i s e s t i
tutii	t u t i i
kierrätyskelpoinen	k i e r r ä t y s k e l p o i n e n
syrjäksi	s y r j ä k s i
erotin	e r o t i n
rahapuhelin	r a h a p u h e l i n
höyrykypsennys	h ö y r y k y p s e n n y s
vihreäsilmäisyys	v i h r e ä s i l m ä i s y y s
banaalistumista	b a n a a l i s t u m i s t a
geoterminen	g e o t e r m i n e n
geomorfologisesti	g e o m o r f o l o g i s e s t i
alusrimoitus	a l u s r i m o i t u s
kesäkuu	k e s ä k u u
seesamiöljy	s e e s a m i ö l j y
villikissa	v i l l i k i s s a
vasikkaa	v a s i k k a a
elinkysymys	e l i n k y s y m y s
rättikatto	r ä t t i k a t t o
kissoista	k i s s o i s t a
sopimusperusteinen	s o p i m u s p e r u s t e i n e n
astuttane	a s t u t t a n e
Etiopialta	E t i o p i a l t a
tuomarilla	t u o m a r i l l a
kartanonherra	k a r t a n o n h e r r a
märi	m ä r i
etupainotteisuus	e t u p a i n o t t e i s u u s
abnormiteetti	a b n o r m i t e e t t i
vauraus	v a u r a u s
tilannekuvaus	t i l a n n e k u v a u s
kuvataidekoulu	k u v a t a i d e k o u l u
jäsenliitto	j ä s e n l i i t t o
akanvirta	a k a n v i r t a
käyttäytymisohje	k ä y t t ä y t y m i s o h j e
marmorikivi	m a r m o r i k i v i
paistokset	p a i s t o k s e t
kurkata	k u r k a t a
katetroi	k a t e t r o i
rynniminen	r y n n i m i n e n
hidastu	h i d a s t u
oikeuksineen	o i k e u k s i n e e n
moottoriveneily	m o o t t o r i v e n e i l y
ylikuormittaa	y l i k u o r m i t t a a
reflektiivisyys	r e f l e k t i i v i s y y s
nautintoainekasvi	n a u t i n t o a i n e k a s v i
kuulosta	k u u l o s t a
kurkkio	k u r k k i o
pogosta	p o g o s t a
kalendaarinen	k a l e n d a a r i n e n
antasidinen	a n t a s i d i n e n
hihnakenkä	h i h n a k e n k ä
nukenrattaat	n u k e n r a t t a a t
bistrot	b i s t r o t
vaivoin	v a i v o i n
sukaksi	s u k a k s i
harmistui	h a r m i s t u i
tasavireinen	t a s a v i r e i n e n
voittoajan	v o i t t o a j a n
älytän	ä l y t ä n
pomoni	p o m o n i
taukoa	t a u k o a
laivana	l a i v a n a
hanhia	h a n h i a
napsahdus	n a p s a h d u s
kasaantua	k a s a a n t u a
piikkaus	p i i k k a u s
frax-oireyhtymä	f r a x - o i r e y h t y m ä
karjalanneito	k a r j a l a n n e i t o
pehmoeläin	p e h m o e l ä i n
horna	h o r n a
kuntoutusallas	k u n t o u t u s a l l a s
lautakasa	l a u t a k a s a
kattavuus	k a t t a v u u s
kulta-arvo	k u l t a - a r v o
uneksijan	u n e k s i j a n
ksenofilia	k s e n o f i l i a
assistentit	a s s i s t e n t i t
Salme	S a l m e
ujuttaudu	u j u t t a u d u
aventimia	a v e n t i m i a
n-propanoleilta	n - p r o p a n o l e i l t a
sievennys	s i e v e n n y s
taimena	t a i m e n a
infektoituva	i n f e k t o i t u v a
unen	u n e n
raudoilla	r a u d o i l l a
retkahtaa	r e t k a h t a a
vesiliukurata	v e s i l i u k u r a t a
tehdä	t e h d ä
variksien	v a r i k s i e n
tuomareita	t u o m a r e i t a
elinkorko	e l i n k o r k o
niistetään	n i i s t e t ä ä n
kuomureki	k u o m u r e k i
joukkoammunta	j o u k k o a m m u n t a
karia	k a r i a
aatta	a a t t a
taskuraha	t a s k u r a h a
arabitasavalta	a r a b i t a s a v a l t a
lyhistyä	l y h i s t y ä
maalaistua	m a a l a i s t u a
äänestäjäkunta	ä ä n e s t ä j ä k u n t a
onnettaret	o n n e t t a r e t
teolta	t e o l t a
kumarassa	k u m a r a s s a
makrobiootikot	m a k r o b i o o t i k o t
ohdakeperhonen	o h d a k e p e r h o n e n
gerbilleistä	g e r b i l l e i s t ä
lyötä	l y ö t ä
akklimatisoituminen	a k k l i m a t i s o i t u m i n e n
hypi	h y p i
anoppilat	a n o p p i l a t
pystykorvainen	p y s t y k o r v a i n e n
työntyä	t y ö n t y ä
desmosomi	d e s m o s o m i
polviksi	p o l v i k s i
raivaaminen	r a i v a a m i n e n
hallitsijanvakuutus	h a l l i t s i j a n v a k u u t u s
detaljoitu	d e t a l j o i t u
yhdestätoista	y h d e s t ä t o i s t a
vahventuminen	v a h v e n t u m i n e n
aktivoitumaisillaan	a k t i v o i t u m a i s i l l a a n
emännöitse	e m ä n n ö i t s e
rakennukselta	r a k e n n u k s e l t a
huolit	h u o l i t
mokkaturkki	m o k k a t u r k k i
B-oikeuksista	B - o i k e u k s i s t a
tarokkikortti	t a r o k k i k o r t t i
olkahermopunos	o l k a h e r m o p u n o s
sorsetti	s o r s e t t i
infektoida	i n f e k t o i d a
tilaetu	t i l a e t u
irtiotto	i r t i o t t o
puupäästäinen	p u u p ä ä s t ä i n e n
jeeveli	j e e v e l i
äimistynyt	ä i m i s t y n y t
uuttu	u u t t u
somejansa	s o m e j a n s a
akselit	a k s e l i t
varteenotettava	v a r t e e n o t e t t a v a
keittotaito	k e i t t o t a i t o
työltä	t y ö l t ä
mankeli	m a n k e l i
rivosuinen	r i v o s u i n e n
eräisiin	e r ä i s i i n
performanssitaiteilija	p e r f o r m a n s s i t a i t e i l i j a
demoni	d e m o n i
korskunta	k o r s k u n t a
vaistoammunta	v a i s t o a m m u n t a
lastenseimi	l a s t e n s e i m i
kioski	k i o s k i
karike	k a r i k e
ojikon	o j i k o n
Kangasalla	K a n g a s a l l a
kulttuurisihteeri	k u l t t u u r i s i h t e e r i
kserofyytti	k s e r o f y y t t i
liittymät	l i i t t y m ä t
nukleoni	n u k l e o n i
kalatalous	k a l a t a l o u s
uintimatka	u i n t i m a t k a
kitkakerroin	k i t k a k e r r o i n
ruso	r u s o
päämäärätietoisuus	p ä ä m ä ä r ä t i e t o i s u u s
savunharmaa	s a v u n h a r m a a
profiilikuva	p r o f i i l i k u v a
pappisura	p a p p i s u r a
kerskakulutus	k e r s k a k u l u t u s
pyrstö	p y r s t ö
instrumentoiminen	i n s t r u m e n t o i m i n e n
kahdeksasosat	k a h d e k s a s o s a t
eteni	e t e n i
kaavoitusmenettely	k a a v o i t u s m e n e t t e l y
vihmoi	v i h m o i
maaseutukeskus	m a a s e u t u k e s k u s
purjehtijan	p u r j e h t i j a n
teekupillinen	t e e k u p i l l i n e n
viiksin	v i i k s i n
hyperboloidi	h y p e r b o l o i d i
mietiskellä	m i e t i s k e l l ä
hansakaupunki	h a n s a k a u p u n k i
keväällemme	k e v ä ä l l e m m e
sieppomuura	s i e p p o m u u r a
oletettava	o l e t e t t a v a
olutfestivaali	o l u t f e s t i v a a l i
joulunalusviikko	j o u l u n a l u s v i i k k o
kasvosokea	k a s v o s o k e a
punakuvioinen	p u n a k u v i o i n e n
hallikisa	h a l l i k i s a
väärentäminen	v ä ä r e n t ä m i n e n
jouluapulainen	j o u l u a p u l a i n e n
ailahtelevainen	a i l a h t e l e v a i n e n
berberi	b e r b e r i
lämpimille	l ä m p i m i l l e
huolitsevat	h u o l i t s e v a t
hyvälistö	h y v ä l i s t ö
märkile	m ä r k i l e
häkit	h ä k i t
laitteeseen	l a i t t e e s e e n
anestesiaerikoislääkäri	a n e s t e s i a e r i k o i s l ä ä k ä r i
lainsäätämisjärjestys	l a i n s ä ä t ä m i s j ä r j e s t y s
kahtaissara	k a h t a i s s a r a
turvottaa	t u r v o t t a a
logopedialla	l o g o p e d i a l l a
materiaalitekniikka	m a t e r i a a l i t e k n i i k k a
jargoneissa	j a r g o n e i s s a
arkipäiväistynee	a r k i p ä i v ä i s t y n e e
ostella	o s t e l l a
viimeistää	v i i m e i s t ä ä
avojalkainen	a v o j a l k a i n e n
ennakkoäänestys	e n n a k k o ä ä n e s t y s
pakettiauto	p a k e t t i a u t o
rasti	r a s t i
lärvi	l ä r v i
vertaileminen	v e r t a i l e m i n e n
kranaattituli	k r a n a a t t i t u l i
ihmisinä	i h m i s i n ä
nettitreffit	n e t t i t r e f f i t
lakkisifaka	l a k k i s i f a k a
artefaktit	a r t e f a k t i t
majakka-alus	m a j a k k a - a l u s
ensimmäiseen	e n s i m m ä i s e e n
suolaa	s u o l a a
tarvike	t a r v i k e
kuntoutuslaitos	k u n t o u t u s l a i t o s
älyverkko	ä l y v e r k k o
friisiläinen	f r i i s i l ä i n e n
siekailla	s i e k a i l l a
väistimen	v ä i s t i m e n
holhonnan	h o l h o n n a n
linja-autosta	l i n j a - a u t o s t a
alistuttaman	a l i s t u t t a m a n
kadota	k a d o t a
sähkökentän	s ä h k ö k e n t ä n
demokraattistuu	d e m o k r a a t t i s t u u
neljänneskilon	n e l j ä n n e s k i l o n
hyrrähaihdutin	h y r r ä h a i h d u t i n
oheislaite	o h e i s l a i t e
liikennevälinetekniikka	l i i k e n n e v ä l i n e t e k n i i k k a
ydinaseet	y d i n a s e e t
sähköenergia	s ä h k ö e n e r g i a
heiton	h e i t o n
sektoraalinen	s e k t o r a a l i n e n
annuiteetit	a n n u i t e e t i t
olkalaukku	o l k a l a u k k u
ruksia	r u k s i a
pääte-emulaattori	p ä ä t e - e m u l a a t t o r i
äkääntykööt	ä k ä ä n t y k ö ö t
mahonginruskea	m a h o n g i n r u s k e a
kantoaika	k a n t o a i k a
kadunlakaisukone	k a d u n l a k a i s u k o n e
nurmijärvinen	n u r m i j ä r v i n e n
roskiksi	r o s k i k s i
amerikanvaivaispäästäinen	a m e r i k a n v a i v a i s p ä ä s t ä i n e n
työesteen	t y ö e s t e e n
kiekaisu	k i e k a i s u
laitatan	l a i t a t a n
kevääseesi	k e v ä ä s e e s i
putkilla	p u t k i l l a
pensan	p e n s a n
epäreilu	e p ä r e i l u
alentuisin	a l e n t u i s i n
ajetuttane	a j e t u t t a n e
oreja	o r e j a
johtajalääkäri	j o h t a j a l ä ä k ä r i
ennakkosuosikki	e n n a k k o s u o s i k k i
liuotusaine	l i u o t u s a i n e
simpanssit	s i m p a n s s i t
tarusto	t a r u s t o
kapeimpine	k a p e i m p i n e
sisäsiistien	s i s ä s i i s t i e n
häilyväinen	h ä i l y v ä i n e n
pieksemättä	p i e k s e m ä t t ä
otsatöyhtö	o t s a t ö y h t ö
diaari	d i a a r i
laidasta	l a i d a s t a
uhoat	u h o a t
skannata	s k a n n a t a
opiskelijalehti	o p i s k e l i j a l e h t i
yksinkertaisia	y k s i n k e r t a i s i a
anteeksipyytelemätön	a n t e e k s i p y y t e l e m ä t ö n
futurologin	f u t u r o l o g i n
tieto-oppi	t i e t o - o p p i
lohessa	l o h e s s a
esikuvallisuus	e s i k u v a l l i s u u s
aloittajat	a l o i t t a j a t
asettautuu	a s e t t a u t u u
ilmoittanut	i l m o i t t a n u t
ilmakammio	i l m a k a m m i o
puolusta	p u o l u s t a
bronkopulmonaalinen	b r o n k o p u l m o n a a l i n e n
heittelekenttä	h e i t t e l e k e n t t ä
ahavoja	a h a v o j a
hälytin	h ä l y t i n
turso	t u r s o
umpeenmeno	u m p e e n m e n o
aktiivistuakseen	a k t i i v i s t u a k s e e n
repussa	r e p u s s a
reaalipolitiikka	r e a a l i p o l i t i i k k a
tuppina	t u p p i n a
oppimisvalmius	o p p i m i s v a l m i u s
rajoittua	r a j o i t t u a
lirahdella	l i r a h d e l l a
demagogisuus	d e m a g o g i s u u s
kuorma-auton	k u o r m a - a u t o n
lasinpuhallus	l a s i n p u h a l l u s
joukkoanomus	j o u k k o a n o m u s
ehätän	e h ä t ä n
diivailla	d i i v a i l l a
kytkitte	k y t k i t t e
jäykentyi	j ä y k e n t y i
juratsin	j u r a t s i n
risukon	r i s u k o n
lainakirja	l a i n a k i r j a
assimiloiduttaneen	a s s i m i l o i d u t t a n e e n
palloilu	p a l l o i l u
voivotella	v o i v o t e l l a
paalusolmu	p a a l u s o l m u
vesistökuormitus	v e s i s t ö k u o r m i t u s
nykyaikaisesti	n y k y a i k a i s e s t i
sokeroitua	s o k e r o i t u a
järjestäytymispakko	j ä r j e s t ä y t y m i s p a k k o
lintuina	l i n t u i n a
kirkonkirjoille	k i r k o n k i r j o i l l e
sylitysten	s y l i t y s t e n
kotihoito	k o t i h o i t o
dermatologian	d e r m a t o l o g i a n
säteilyvaaran	s ä t e i l y v a a r a n
hebefiili	h e b e f i i l i
ällistyttämän	ä l l i s t y t t ä m ä n
karaiitti	k a r a i i t t i
abstraktistaminen	a b s t r a k t i s t a m i n e n
yksien	y k s i e n
kehitysnäkymä	k e h i t y s n ä k y m ä
palvelin	p a l v e l i n
punamusta	p u n a m u s t a
masiina	m a s i i n a
kultahääpäivä	k u l t a h ä ä p ä i v ä
suksikotelo	s u k s i k o t e l o
selväpäinen	s e l v ä p ä i n e n
ilkamoida	i l k a m o i d a
vatukko	v a t u k k o
ableistinen	a b l e i s t i n e n
taksat	t a k s a t
hienoine	h i e n o i n e
havainnoin	h a v a i n n o i n
tappeleminen	t a p p e l e m i n e n
lisäpainos	l i s ä p a i n o s
kosteusmittari	k o s t e u s m i t t a r i
pitkätukka	p i t k ä t u k k a
zootoksiini	z o o t o k s i i n i
somerikot	s o m e r i k o t
rimpsu	r i m p s u
letukan	l e t u k a n
fennomanian	f e n n o m a n i a n
lohirysä	l o h i r y s ä
kumulaatio	k u m u l a a t i o
halkokauppias	h a l k o k a u p p i a s
nielemisvaikeus	n i e l e m i s v a i k e u s
smokin	s m o k i n
käärinliina	k ä ä r i n l i i n a
pitkämielisesti	p i t k ä m i e l i s e s t i
ähkyisivät	ä h k y i s i v ä t
velisurmaaja	v e l i s u r m a a j a
vesikehä	v e s i k e h ä
kultakutriplaneetta	k u l t a k u t r i p l a n e e t t a
leikinpäin	l e i k i n p ä i n
poroporvari	p o r o p o r v a r i
parlamenttivaali	p a r l a m e n t t i v a a l i
fenolin	f e n o l i n
talveen	t a l v e e n
hoettavalle	h o e t t a v a l l e
Kyyros	K y y r o s
saneli	s a n e l i
lähdettäne	l ä h d e t t ä n e
yksityisti	y k s i t y i s t i
kannokot	k a n n o k o t
työliike	t y ö l i i k e
rikosjuttu	r i k o s j u t t u
säteilijän	s ä t e i l i j ä n
poistuman	p o i s t u m a n
hydroksietyyli-prometatsiini	h y d r o k s i e t y y l i - p r o m e t a t s i i n i
arvostus	a r v o s t u s
nimikointi	n i m i k o i n t i
sammuttamaan	s a m m u t t a m a a n
amerikanmuikku	a m e r i k a n m u i k k u
tasaväkinen	t a s a v ä k i n e n
aristokraattisuudet	a r i s t o k r a a t t i s u u d e t
arkipäiväisty	a r k i p ä i v ä i s t y
urheilija	u r h e i l i j a
uuhin	u u h i n
vedenpuhdistin	v e d e n p u h d i s t i n
hevostenhoitaja	h e v o s t e n h o i t a j a
lihaksinen	l i h a k s i n e n
virtsatietulehdus	v i r t s a t i e t u l e h d u s
hännystakki	h ä n n y s t a k k i
amoraalinen	a m o r a a l i n e n
saariksi	s a a r i k s i
lamarckismi	l a m a r c k i s m i
malagassi	m a l a g a s s i
sotiin	s o t i i n
nuket	n u k e t
kultarousku	k u l t a r o u s k u
virvoittelu	v i r v o i t t e l u
holvaus	h o l v a u s
alkumuoto	a l k u m u o t o
surullinen	s u r u l l i n e n
keilailla	k e i l a i l l a
lanseeraus	l a n s e e r a u s
käyttötavara	k ä y t t ö t a v a r a
useammanlaiset	u s e a m m a n l a i s e t
elokuvakriitikko	e l o k u v a k r i i t i k k o
metsästyslaukku	m e t s ä s t y s l a u k k u
seksifilmi	s e k s i f i l m i
koodata	k o o d a t a
talousjournalismi	t a l o u s j o u r n a l i s m i
äänekkäästi	ä ä n e k k ä ä s t i
aleksanterintorttu	a l e k s a n t e r i n t o r t t u
joukkotyöttömyys	j o u k k o t y ö t t ö m y y s
taoimme	t a o i m m e
lämpimin	l ä m p i m i n
sauvamagneetti	s a u v a m a g n e e t t i
stimulointi	s t i m u l o i n t i
kirjekuori	k i r j e k u o r i
viikolle	v i i k o l l e
liettualainen	l i e t t u a l a i n e n
kurahousut	k u r a h o u s u t
epidemiat	e p i d e m i a t
tarkasteleminen	t a r k a s t e l e m i n e n
kuoli	k u o l i
poikkeusjärjestely	p o i k k e u s j ä r j e s t e l y
seurassa	s e u r a s s a
pitkittäisaalto	p i t k i t t ä i s a a l t o
tuhatta	t u h a t t a
nikarainen	n i k a r a i n e n
demiseksuaali	d e m i s e k s u a a l i
Mönkäre	M ö n k ä r e
eskimokoira	e s k i m o k o i r a
korkealentoinen	k o r k e a l e n t o i n e n
reelinki	r e e l i n k i
ärsyynnyin	ä r s y y n n y i n
kielenulkoinen	k i e l e n u l k o i n e n
alkaessa	a l k a e s s a
helmikuuhun	h e l m i k u u h u n
vinokatto	v i n o k a t t o
kahlitsit	k a h l i t s i t
toitte	t o i t t e
oikeuden	o i k e u d e n
syklamaatti	s y k l a m a a t t i
damaskit	d a m a s k i t
vääräpää	v ä ä r ä p ä ä
purkaamo	p u r k a a m o
kolmiperhehoito	k o l m i p e r h e h o i t o
laippaliitos	l a i p p a l i i t o s
gettoistuu	g e t t o i s t u u
hevossiittola	h e v o s s i i t t o l a
helskeet	h e l s k e e t
akoiksi	a k o i k s i
-öittää	- ö i t t ä ä
seepraluhtakana	s e e p r a l u h t a k a n a
haimatauti	h a i m a t a u t i
tonget	t o n g e t
jaettuna	j a e t t u n a
korjattavillansa	k o r j a t t a v i l l a n s a
putkiremontti	p u t k i r e m o n t t i
muotokuvamaalari	m u o t o k u v a m a a l a r i
parillisuus	p a r i l l i s u u s
mäntykiitäjä	m ä n t y k i i t ä j ä
neulaston	n e u l a s t o n
lajien	l a j i e n
liiviläinen	l i i v i l ä i n e n
vaisto	v a i s t o
’auhelawa	’ a u h e l a w a
grafiikkasuoritin	g r a f i i k k a s u o r i t i n
kuivatokka	k u i v a t o k k a
biennaalin	b i e n n a a l i n
kompa	k o m p a
aristuneet	a r i s t u n e e t
asuakseen	a s u a k s e e n
voimansiirtojohto	v o i m a n s i i r t o j o h t o
eristäjän	e r i s t ä j ä n
kuulosignaali	k u u l o s i g n a a l i
puoliso	p u o l i s o
rääseiköt	r ä ä s e i k ö t
keittiömestari	k e i t t i ö m e s t a r i
kivirae	k i v i r a e
aseettomuudet	a s e e t t o m u u d e t
sanakirjantoimittaja	s a n a k i r j a n t o i m i t t a j a
sytoarkkitehtuuri	s y t o a r k k i t e h t u u r i
juttuhetki	j u t t u h e t k i
teräsrunkoinen	t e r ä s r u n k o i n e n
immateriaalioikeudet	i m m a t e r i a a l i o i k e u d e t
avioitunee	a v i o i t u n e e
kansansävelmä	k a n s a n s ä v e l m ä
harjoittajan	h a r j o i t t a j a n
kinkkukiusaus	k i n k k u k i u s a u s
trapetsitaiteilija	t r a p e t s i t a i t e i l i j a
keuhkoemfyseema	k e u h k o e m f y s e e m a
kahdeksankymmentäyksi	k a h d e k s a n k y m m e n t ä y k s i
assosiaatiolait	a s s o s i a a t i o l a i t
lumilammas	l u m i l a m m a s
hermoissa	h e r m o i s s a
vasemmanpuolimmainen	v a s e m m a n p u o l i m m a i n e n
airuetta	a i r u e t t a
oikeusministeriön	o i k e u s m i n i s t e r i ö n
vakuuttaneet	v a k u u t t a n e e t
ruokakolmio	r u o k a k o l m i o
kouluretkeily	k o u l u r e t k e i l y
betonoinnit	b e t o n o i n n i t
toisi	t o i s i
-hun	- h u n
tarkkuusluokka	t a r k k u u s l u o k k a
smakki	s m a k k i
vapaakaupunki	v a p a a k a u p u n k i
luontojaan	l u o n t o j a a n
Huhtamäki	H u h t a m ä k i
Ranskanmaa	R a n s k a n m a a
tappouhkaus	t a p p o u h k a u s
republikaani	r e p u b l i k a a n i
läiskähdellä	l ä i s k ä h d e l l ä
auditoinnit	a u d i t o i n n i t
suihkuverho	s u i h k u v e r h o
löydöt	l ö y d ö t
tyhmän	t y h m ä n
puolineen	p u o l i n e e n
valmistusvirheiden	v a l m i s t u s v i r h e i d e n
kaakaopapu	k a a k a o p a p u
myyntipalkkio	m y y n t i p a l k k i o
renttuilla	r e n t t u i l l a
pilkkaaja	p i l k k a a j a
sorsimo	s o r s i m o
tulppaanilasi	t u l p p a a n i l a s i
kiittelemässä	k i i t t e l e m ä s s ä
konkurssitila	k o n k u r s s i t i l a
kulminaation	k u l m i n a a t i o n
kalpaveljekset	k a l p a v e l j e k s e t
tanssijattaressa	t a n s s i j a t t a r e s s a
kaviokuonoyökkö	k a v i o k u o n o y ö k k ö
tuppikeksi	t u p p i k e k s i
herttakasi	h e r t t a k a s i
mestariluomus	m e s t a r i l u o m u s
korjattavaksensa	k o r j a t t a v a k s e n s a
öykkärin	ö y k k ä r i n
alueisiin	a l u e i s i i n
Jumalatta	J u m a l a t t a
piehtaroi	p i e h t a r o i
nelistä	n e l i s t ä
toffeeomena	t o f f e e o m e n a
valmiin	v a l m i i n
hokeneiden	h o k e n e i d e n
sopimusten	s o p i m u s t e n
pujoa	p u j o a
hatikka	h a t i k k a
liikkeenkaappaus	l i i k k e e n k a a p p a u s
kolmaskymmenesneljäs	k o l m a s k y m m e n e s n e l j ä s
kotikirjasto	k o t i k i r j a s t o
suulalle	s u u l a l l e
jaffakeksi	j a f f a k e k s i
akoittuisi	a k o i t t u i s i
livertää	l i v e r t ä ä
työttömyyspäivä	t y ö t t ö m y y s p ä i v ä
montaa	m o n t a a
urheiluhallin	u r h e i l u h a l l i n
esineet	e s i n e e t
nimekkyyden	n i m e k k y y d e n
umpipiha	u m p i p i h a
