tilalla	t i l a l l a
jokaisen	j o k a i s e n
krooninen	k r o o n i n e n
syntyy	s y n t y y
osaavat	o s a a v a t
pystyssä	p y s t y s s ä
jäljempänä	j ä l j e m p ä n ä
EKP	E K P
toimittajan	t o i m i t t a j a n
nyt	n y t
enemmän	e n e m m ä n
kävijän	k ä v i j ä n
oikea-aikainen	o i k e a - a i k a i n e n
seksiä	s e k s i ä
ostat	o s t a t
Leino	L e i n o
oikeutta	o i k e u t t a
kyse	k y s e
luominen	l u o m i n e n
tekijä	t e k i j ä
joten	j o t e n
ajatelkaa	a j a t e l k a a
kohteena	k o h t e e n a
hän	h ä n
sopia	s o p i a
tavoitteena	t a v o i t t e e n a
maito	m a i t o
voinut	v o i n u t
Keskinen	K e s k i n e n
arvonnan	a r v o n n a n
ajattelet	a j a t t e l e t
asiakkaan	a s i a k k a a n
ilman	i l m a n
lunastus	l u n a s t u s
hienomotoriikka	h i e n o m o t o r i i k k a
vihu	v i h u
kuvasta	k u v a s t a
irtisanominen	i r t i s a n o m i n e n
talvi	t a l v i
monille	m o n i l l e
suudella	s u u d e l l a
jään	j ä ä n
laulaja	l a u l a j a
maassa	m a a s s a
tahraton	t a h r a t o n
profiili	p r o f i i l i
alamäki	a l a m ä k i
väärin	v ä ä r i n
ajetaan	a j e t a a n
järjestää	j ä r j e s t ä ä
teknisesti	t e k n i s e s t i
kunnon	k u n n o n
mitat	m i t a t
Matti	M a t t i
ääneen	ä ä n e e n
luottamus	l u o t t a m u s
suomeksi	s u o m e k s i
ajoittain	a j o i t t a i n
saa	s a a
puuttuvat	p u u t t u v a t
sittemmin	s i t t e m m i n
tämän	t ä m ä n
välittämättä	v ä l i t t ä m ä t t ä
avaa	a v a a
säteilyn	s ä t e i l y n
piilossa	p i i l o s s a
uusi	u u s i
siirtolapuutarha	s i i r t o l a p u u t a r h a
viimeistä	v i i m e i s t ä
kannattaisi	k a n n a t t a i s i
ovat	o v a t
vähäluminen	v ä h ä l u m i n e n
kuinka	k u i n k a
ihana	i h a n a
komponentit	k o m p o n e n t i t
jatkua	j a t k u a
leviää	l e v i ä ä
kysyi	k y s y i
everstiluutnantti	e v e r s t i l u u t n a n t t i
kirjoittaja	k i r j o i t t a j a
metsäteollisuus	m e t s ä t e o l l i s u u s
kuitenkin	k u i t e n k i n
jatkoin	j a t k o i n
jaamme	j a a m m e
yksinomaan	y k s i n o m a a n
huom.	h u o m .
liikkeeseen	l i i k k e e s e e n
komissio	k o m i s s i o
kuluksi	k u l u k s i
joutui	j o u t u i
tulla	t u l l a
vesissä	v e s i s s ä
minne	m i n n e
pysähtyminen	p y s ä h t y m i n e n
päättyi	p ä ä t t y i
lattialaatta	l a t t i a l a a t t a
konsepti	k o n s e p t i
kuinka	k u i n k a
pahalta	p a h a l t a
laatikon	l a a t i k o n
käyty	k ä y t y
täynnä	t ä y n n ä
joten	j o t e n
naaras	n a a r a s
aineistot	a i n e i s t o t
leikkimielinen	l e i k k i m i e l i n e n
Martikainen	M a r t i k a i n e n
kiri	k i r i
kauneus	k a u n e u s
vaikutus	v a i k u t u s
tallessa	t a l l e s s a
saa	s a a
huivin	h u i v i n
kärsi	k ä r s i
sanoen	s a n o e n
vallan	v a l l a n
sarjat	s a r j a t
panos	p a n o s
lähtee	l ä h t e e
annokset	a n n o k s e t
yhteiskunnallisen	y h t e i s k u n n a l l i s e n
tarkistettu	t a r k i s t e t t u
saa	s a a
veden	v e d e n
Touko	T o u k o
ilmaiseksi	i l m a i s e k s i
joutuu	j o u t u u
aiheuttanut	a i h e u t t a n u t
kuitenkin	k u i t e n k i n
virka	v i r k a
saa	s a a
kiinnostaa	k i i n n o s t a a
siirto	s i i r t o
kuivalla	k u i v a l l a
verho	v e r h o
jotkut	j o t k u t
jolloin	j o l l o i n
lähdemme	l ä h d e m m e
torilla	t o r i l l a
Yhdysvaltain	Y h d y s v a l t a i n
tuntua	t u n t u a
menetelmä	m e n e t e l m ä
joten	j o t e n
syys	s y y s
varat	v a r a t
prosessien	p r o s e s s i e n
kohtaan	k o h t a a n
liittyä	l i i t t y ä
kuvan	k u v a n
laulu	l a u l u
varmaan	v a r m a a n
lempeästi	l e m p e ä s t i
yhtä	y h t ä
kotona	k o t o n a
ellet	e l l e t
huulten	h u u l t e n
Yhdysvaltain	Y h d y s v a l t a i n
kaatui	k a a t u i
työn	t y ö n
tarjolla	t a r j o l l a
talkoovoimin	t a l k o o v o i m i n
lippu	l i p p u
yritys	y r i t y s
työn	t y ö n
alkaa	a l k a a
syksy	s y k s y
retkelle	r e t k e l l e
kaasulla	k a a s u l l a
Sanelma	S a n e l m a
ilman	i l m a n
ovat	o v a t
nähtävillä	n ä h t ä v i l l ä
kanslia	k a n s l i a
Viitala	V i i t a l a
pääjohtajan	p ä ä j o h t a j a n
Ulvila	U l v i l a
sopimusta	s o p i m u s t a
aito	a i t o
työelämän	t y ö e l ä m ä n
pelannut	p e l a n n u t
sanojen	s a n o j e n
muokattu	m u o k a t t u
koiran	k o i r a n
virta	v i r t a
kolmen	k o l m e n
suunnittelema	s u u n n i t t e l e m a
saa	s a a
sidoksissa	s i d o k s i s s a
noeta	n o e t a
tämän	t ä m ä n
takka	t a k k a
helmi	h e l m i
jälkeen	j ä l k e e n
kuvaava	k u v a a v a
pienenä	p i e n e n ä
kaupunki	k a u p u n k i
tiimoilta	t i i m o i l t a
mieto	m i e t o
rakkaus	r a k k a u s
mm.	m m .
arvioinnin	a r v i o i n n i n
riisin	r i i s i n
lampaat	l a m p a a t
käännös	k ä ä n n ö s
poiketa	p o i k e t a
viikkoa	v i i k k o a
kukoistaa	k u k o i s t a a
tietoa	t i e t o a
asun	a s u n
pienenee	p i e n e n e e
kauan	k a u a n
mekon	m e k o n
koskien	k o s k i e n
ilmastointi	i l m a s t o i n t i
kansainvälisissä	k a n s a i n v ä l i s i s s ä
kyl	k y l
elinvoima	e l i n v o i m a
tallentaa	t a l l e n t a a
laittaa	l a i t t a a
hinnasta	h i n n a s t a
tuhansittain	t u h a n s i t t a i n
ryhtyisivät	r y h t y i s i v ä t
Ojanen	O j a n e n
tilanteessa	t i l a n t e e s s a
yleisen	y l e i s e n
ilman	i l m a n
ultraääni	u l t r a ä ä n i
tavalla	t a v a l l a
lokakuun	l o k a k u u n
ry	r y
yö	y ö
vasemmalle	v a s e m m a l l e
itsestäsi	i t s e s t ä s i
niissä	n i i s s ä
keittää	k e i t t ä ä
uskonto	u s k o n t o
jäädä	j ä ä d ä
saa	s a a
makuun	m a k u u n
rankka	r a n k k a
lattiaa	l a t t i a a
viiteen	v i i t e e n
konsepti	k o n s e p t i
ilmestyy	i l m e s t y y
pura	p u r a
asuisi	a s u i s i
huonekalut	h u o n e k a l u t
uudistuksen	u u d i s t u k s e n
tutkittu	t u t k i t t u
joukko	j o u k k o
suomeksi	s u o m e k s i
sä	s ä
ostamaan	o s t a m a a n
metsistä	m e t s i s t ä
lepo	l e p o
osallistuminen	o s a l l i s t u m i n e n
joten	j o t e n
viipymättä	v i i p y m ä t t ä
alkaa	a l k a a
ehkäpä	e h k ä p ä
vapautta	v a p a u t t a
fiilis	f i i l i s
esiin	e s i i n
ihastunut	i h a s t u n u t
joten	j o t e n
etu	e t u
pikavippi	p i k a v i p p i
näkymät	n ä k y m ä t
tavoitellaan	t a v o i t e l l a a n
tarvitse	t a r v i t s e
Turun	T u r u n
tapauksessa	t a p a u k s e s s a
ehti	e h t i
lupaavasti	l u p a a v a s t i
helppokäyttöinen	h e l p p o k ä y t t ö i n e n
koneelle	k o n e e l l e
maaliskuun	m a a l i s k u u n
erillisuuni	e r i l l i s u u n i
elävämpi	e l ä v ä m p i
Hurme	H u r m e
eläinten	e l ä i n t e n
kuljettaja	k u l j e t t a j a
valvonta	v a l v o n t a
tähtitaivas	t ä h t i t a i v a s
syntynyt	s y n t y n y t
Aulikki	A u l i k k i
fiiliksen	f i i l i k s e n
yleiset	y l e i s e t
varmaan	v a r m a a n
mahdollisia	m a h d o l l i s i a
tavalla	t a v a l l a
voimin	v o i m i n
pitkään	p i t k ä ä n
hakemista	h a k e m i s t a
haaste	h a a s t e
järjestöt	j ä r j e s t ö t
ilmiö	i l m i ö
tuntia	t u n t i a
matka	m a t k a
namu	n a m u
tämän	t ä m ä n
tietovaranto	t i e t o v a r a n t o
toimija	t o i m i j a
nuoren	n u o r e n
ääni	ä ä n i
keskusteli	k e s k u s t e l i
aikuiset	a i k u i s e t
samoja	s a m o j a
seksiä	s e k s i ä
tuhottu	t u h o t t u
asiakirja	a s i a k i r j a
vaikutus	v a i k u t u s
määräytyminen	m ä ä r ä y t y m i n e n
puolessa	p u o l e s s a
unten	u n t e n
ovat	o v a t
tuulelle	t u u l e l l e
monella	m o n e l l a
muutettu	m u u t e t t u
maaliskuu	m a a l i s k u u
autoja	a u t o j a
monista	m o n i s t a
selville	s e l v i l l e
Peppi	P e p p i
lääninhallitus	l ä ä n i n h a l l i t u s
varten	v a r t e n
vauvat	v a u v a t
kaksi	k a k s i
Mikkonen	M i k k o n e n
Sari	S a r i
marraskuu	m a r r a s k u u
Helsingin	H e l s i n g i n
jarrut	j a r r u t
arvostelut	a r v o s t e l u t
saatan	s a a t a n
ilman	i l m a n
halua	h a l u a
tarkoittaa	t a r k o i t t a a
tapoja	t a p o j a
kirkkaita	k i r k k a i t a
ovat	o v a t
ymmärtääkseen	y m m ä r t ä ä k s e e n
maksaminen	m a k s a m i n e n
tutkii	t u t k i i
vallasta	v a l l a s t a
Harri	H a r r i
vesillä	v e s i l l ä
ensimmäistä	e n s i m m ä i s t ä
Elia	E l i a
jätti	j ä t t i
pohtia	p o h t i a
nukkumaan	n u k k u m a a n
eräänä	e r ä ä n ä
hankala	h a n k a l a
edullisempi	e d u l l i s e m p i
aurinkoa	a u r i n k o a
muokata	m u o k a t a
saattohoito	s a a t t o h o i t o
viestin	v i e s t i n
luonnon	l u o n n o n
antaa	a n t a a
Karoliina	K a r o l i i n a
välikohtaus	v ä l i k o h t a u s
miltei	m i l t e i
jäsenvaltioiden	j ä s e n v a l t i o i d e n
käytössä	k ä y t ö s s ä
äitini	ä i t i n i
kehityksen	k e h i t y k s e n
eksklusiivinen	e k s k l u s i i v i n e n
selvitä	s e l v i t ä
korvalappustereot	k o r v a l a p p u s t e r e o t
itseensä	i t s e e n s ä
iloon	i l o o n
harrastaa	h a r r a s t a a
saa	s a a
asetuksia	a s e t u k s i a
pihat	p i h a t
jutellaan	j u t e l l a a n
muistat	m u i s t a t
vieläkin	v i e l ä k i n
päde	p ä d e
esitetyt	e s i t e t y t
Hiltunen	H i l t u n e n
griini	g r i i n i
Reijo	R e i j o
olosi	o l o s i
asiakkaan	a s i a k k a a n
katsoi	k a t s o i
elinkeinoelämän	e l i n k e i n o e l ä m ä n
lunta	l u n t a
tietoa	t i e t o a
mitään	m i t ä ä n
käännös	k ä ä n n ö s
ruokailla	r u o k a i l l a
alkajaisiksi	a l k a j a i s i k s i
kumpikin	k u m p i k i n
oppilaan	o p p i l a a n
kisaan	k i s a a n
sinusta	s i n u s t a
polvista	p o l v i s t a
kikat	k i k a t
ollut	o l l u t
hän	h ä n
rukoilen	r u k o i l e n
tapauksessa	t a p a u k s e s s a
kahteen	k a h t e e n
tuntui	t u n t u i
sanoja	s a n o j a
närhi	n ä r h i
taito	t a i t o
Venäjästä	V e n ä j ä s t ä
tammikuun	t a m m i k u u n
Lukkarinen	L u k k a r i n e n
tekee	t e k e e
viikon	v i i k o n
Veera	V e e r a
tomusokeri	t o m u s o k e r i
pyhän	p y h ä n
selitettynä	s e l i t e t t y n ä
kilpailuttaa	k i l p a i l u t t a a
enää	e n ä ä
sosiaaliturva	s o s i a a l i t u r v a
alkaa	a l k a a
sukulainen	s u k u l a i n e n
suuri	s u u r i
niitä	n i i t ä
sopia	s o p i a
mahalaukun	m a h a l a u k u n
koepala	k o e p a l a
ulkomailla	u l k o m a i l l a
matkaan	m a t k a a n
todennäköisyydellä	t o d e n n ä k ö i s y y d e l l ä
hermostuneesti	h e r m o s t u n e e s t i
tietoa	t i e t o a
laskettu	l a s k e t t u
ajankohdan	a j a n k o h d a n
tanssii	t a n s s i i
elinkeinoelämä	e l i n k e i n o e l ä m ä
uutiskanava	u u t i s k a n a v a
kuningas	k u n i n g a s
ilman	i l m a n
syötiin	s y ö t i i n
entistä	e n t i s t ä
ollut	o l l u t
niitä	n i i t ä
isompi	i s o m p i
edut	e d u t
ilma	i l m a
näkemys	n ä k e m y s
muiden	m u i d e n
lausunnon	l a u s u n n o n
pöytä	p ö y t ä
lisä	l i s ä
tarkoista	t a r k o i s t a
kutsua	k u t s u a
mistä	m i s t ä
tutkimus	t u t k i m u s
tämän	t ä m ä n
hevosten	h e v o s t e n
tämän	t ä m ä n
tehköön	t e h k ö ö n
söin	s ö i n
ihana	i h a n a
toimeen	t o i m e e n
eriä	e r i ä
aiemminkin	a i e m m i n k i n
elokuvaan	e l o k u v a a n
paljain	p a l j a i n
Virpi	V i r p i
hetkiä	h e t k i ä
hengiltä	h e n g i l t ä
ruoka	r u o k a
öljyn	ö l j y n
juoman	j u o m a n
ollut	o l l u t
maailmansota	m a a i l m a n s o t a
lamppu	l a m p p u
Yorkin	Y o r k i n
väliaikaisesti	v ä l i a i k a i s e s t i
joten	j o t e n
hakee	h a k e e
erityisen	e r i t y i s e n
syksyllä	s y k s y l l ä
sellainen	s e l l a i n e n
mitään	m i t ä ä n
muiden	m u i d e n
suuri	s u u r i
merkkien	m e r k k i e n
kuulivat	k u u l i v a t
adsorboitua	a d s o r b o i t u a
kaikkia	k a i k k i a
Oy	O y
tahti	t a h t i
pyörän	p y ö r ä n
kiepahtaa	k i e p a h t a a
katon	k a t o n
ohjeista	o h j e i s t a
ovat	o v a t
osasta	o s a s t a
valitse	v a l i t s e
aatteen	a a t t e e n
voita	v o i t a
lopetin	l o p e t i n
lyhyellä	l y h y e l l ä
Kiinassa	K i i n a s s a
olleita	o l l e i t a
ip.	i p .
äitinsä	ä i t i n s ä
keltit	k e l t i t
päivitys	p ä i v i t y s
jollain	j o l l a i n
vasemman	v a s e m m a n
vahvin	v a h v i n
ekstruusio	e k s t r u u s i o
Suo	S u o
käynnistyy	k ä y n n i s t y y
englanti	e n g l a n t i
Aarno	A a r n o
tehon	t e h o n
kesk	k e s k
runko	r u n k o
rahoittaa	r a h o i t t a a
kukin	k u k i n
helpoin	h e l p o i n
lammas	l a m m a s
vähän	v ä h ä n
allekirjoitus	a l l e k i r j o i t u s
kehuja	k e h u j a
seurauksena	s e u r a u k s e n a
kokoa	k o k o a
mistä	m i s t ä
saa	s a a
työterveys	t y ö t e r v e y s
opinnot	o p i n n o t
ovat	o v a t
vaati	v a a t i
yhdessä	y h d e s s ä
sanoilla	s a n o i l l a
laakeri	l a a k e r i
todeta	t o d e t a
eli	e l i
lukijan	l u k i j a n
vastaavat	v a s t a a v a t
löytyi	l ö y t y i
tietoa	t i e t o a
luotu	l u o t u
kiinnostunut	k i i n n o s t u n u t
taka-	t a k a -
kutu	k u t u
ohjaat	o h j a a t
vaikuta	v a i k u t a
jäädä	j ä ä d ä
tähdet	t ä h d e t
antaa	a n t a a
sooda	s o o d a
sama	s a m a
sakkoja	s a k k o j a
Ronja	R o n j a
kansainvälisiä	k a n s a i n v ä l i s i ä
liikkui	l i i k k u i
pieneksi	p i e n e k s i
mahdollisimman	m a h d o l l i s i m m a n
lahjan	l a h j a n
kaksi	k a k s i
antamisen	a n t a m i s e n
puolestani	p u o l e s t a n i
ilmaisin	i l m a i s i n
halpa	h a l p a
värin	v ä r i n
salailu	s a l a i l u
maksutapa	m a k s u t a p a
Luoja	L u o j a
ohjelmallinen	o h j e l m a l l i n e n
päiväksi	p ä i v ä k s i
haave	h a a v e
suunnattu	s u u n n a t t u
herkullinen	h e r k u l l i n e n
tiedät	t i e d ä t
lykätä	l y k ä t ä
totella	t o t e l l a
tulostaa	t u l o s t a a
yrittänyt	y r i t t ä n y t
mukautuminen	m u k a u t u m i n e n
kansainvälinen	k a n s a i n v ä l i n e n
kauhean	k a u h e a n
antaa	a n t a a
järjetön	j ä r j e t ö n
polystyreeni	p o l y s t y r e e n i
eikö	e i k ö
ovat	o v a t
saa	s a a
kutsuttu	k u t s u t t u
salit	s a l i t
ulkomaalaiset	u l k o m a a l a i s e t
toisille	t o i s i l l e
olettaa	o l e t t a a
viikossa	v i i k o s s a
moderni	m o d e r n i
aloittaa	a l o i t t a a
kilpailuajan	k i l p a i l u a j a n
enää	e n ä ä
ympäristönsuojelu	y m p ä r i s t ö n s u o j e l u
tunti	t u n t i
nyt	n y t
merkitsee	m e r k i t s e e
muiden	m u i d e n
ollut	o l l u t
omine	o m i n e
Kristuksen	K r i s t u k s e n
kauempana	k a u e m p a n a
haluttu	h a l u t t u
läpinäkyvä	l ä p i n ä k y v ä
tehtailla	t e h t a i l l a
kerroin	k e r r o i n
valkosuklaa	v a l k o s u k l a a
tärkeintä	t ä r k e i n t ä
turvallisuutta	t u r v a l l i s u u t t a
järkeilee	j ä r k e i l e e
tieteen	t i e t e e n
Korkein	K o r k e i n
vapaa-ajan	v a p a a - a j a n
tekoon	t e k o o n
syytetään	s y y t e t ä ä n
hiippailla	h i i p p a i l l a
alkua	a l k u a
Oinas	O i n a s
ulkoasu	u l k o a s u
tila	t i l a
hinnoin	h i n n o i n
Hattula	H a t t u l a
runous	r u n o u s
sataa	s a t a a
ajoi	a j o i
kuinka	k u i n k a
ammattikorkeakoulun	a m m a t t i k o r k e a k o u l u n
vaihe	v a i h e
tämä	t ä m ä
talous	t a l o u s
kyseinen	k y s e i n e n
välähdys	v ä l ä h d y s
framille	f r a m i l l e
huonoa	h u o n o a
vähän	v ä h ä n
valtaosa	v a l t a o s a
elämässä	e l ä m ä s s ä
painava	p a i n a v a
poliisilaitos	p o l i i s i l a i t o s
kyseli	k y s e l i
muodostua	m u o d o s t u a
Ukraina	U k r a i n a
sanottuna	s a n o t t u n a
todellisesti	t o d e l l i s e s t i
kilpailijan	k i l p a i l i j a n
alle	a l l e
teknillinen	t e k n i l l i n e n
reipas	r e i p a s
myöhemmin	m y ö h e m m i n
laitama	l a i t a m a
helmikuun	h e l m i k u u n
kärkeen	k ä r k e e n
ollut	o l l u t
ammattikorkeakoulu	a m m a t t i k o r k e a k o u l u
pienelle	p i e n e l l e
Jeesuksen	J e e s u k s e n
vähän	v ä h ä n
kuntien	k u n t i e n
lasit	l a s i t
läpinäkymätön	l ä p i n ä k y m ä t ö n
kuukauden	k u u k a u d e n
enemmän	e n e m m ä n
pystyisi	p y s t y i s i
organisoi	o r g a n i s o i
hevoset	h e v o s e t
upea	u p e a
vahvaa	v a h v a a
myy	m y y
vonkale	v o n k a l e
etsit	e t s i t
valikoida	v a l i k o i d a
sääntö	s ä ä n t ö
nimimerkki	n i m i m e r k k i
turhauttavaa	t u r h a u t t a v a a
ollut	o l l u t
sille	s i l l e
eli	e l i
konkurssiin	k o n k u r s s i i n
itseä	i t s e ä
Urho	U r h o
ehkäisevä	e h k ä i s e v ä
pidetä	p i d e t ä
itsepuolustus	i t s e p u o l u s t u s
välissä	v ä l i s s ä
viimeisen	v i i m e i s e n
pitkäksi	p i t k ä k s i
tilojen	t i l o j e n
runsaasti	r u n s a a s t i
joten	j o t e n
kaikenlaisia	k a i k e n l a i s i a
runsaasti	r u n s a a s t i
ohjannut	o h j a n n u t
neuvoa	n e u v o a
nimensä	n i m e n s ä
eloperäinen	e l o p e r ä i n e n
laitoin	l a i t o i n
uusperhe	u u s p e r h e
100.	1 0 0 .
hän	h ä n
luonnollista	l u o n n o l l i s t a
kaikkia	k a i k k i a
kirjan	k i r j a n
kaikkia	k a i k k i a
virka	v i r k a
raamin	r a a m i n
sukat	s u k a t
kaupunkia	k a u p u n k i a
näyttäisi	n ä y t t ä i s i
lista	l i s t a
lyhyellä	l y h y e l l ä
Veikka	V e i k k a
pyritty	p y r i t t y
aurinkovuosi	a u r i n k o v u o s i
tutkitaan	t u t k i t a a n
mukaan	m u k a a n
sähköpostilla	s ä h k ö p o s t i l l a
verta	v e r t a
lisääminen	l i s ä ä m i n e n
kattoon	k a t t o o n
sanaa	s a n a a
mahdollisimman	m a h d o l l i s i m m a n
vaativat	v a a t i v a t
ainoat	a i n o a t
kuitenkin	k u i t e n k i n
odottanut	o d o t t a n u t
sellaisenaan	s e l l a i s e n a a n
mm.	m m .
voisi	v o i s i
blogi	b l o g i
levittää	l e v i t t ä ä
ollut	o l l u t
vanhaa	v a n h a a
suuri	s u u r i
hänellä	h ä n e l l ä
saatavuuden	s a a t a v u u d e n
akun	a k u n
reagoi	r e a g o i
lemmikki	l e m m i k k i
jutut	j u t u t
robottiauto	r o b o t t i a u t o
päällystäminen	p ä ä l l y s t ä m i n e n
mielen	m i e l e n
valmentaa	v a l m e n t a a
ajalta	a j a l t a
ääni	ä ä n i
Jouko	J o u k o
maksoivat	m a k s o i v a t
esitetty	e s i t e t t y
eteneminen	e t e n e m i n e n
tavallisia	t a v a l l i s i a
entisen	e n t i s e n
valokuvan	v a l o k u v a n
nyt	n y t
ovat	o v a t
Varis	V a r i s
perustaminen	p e r u s t a m i n e n
pariin	p a r i i n
leveys	l e v e y s
maalivahdit	m a a l i v a h d i t
äänistä	ä ä n i s t ä
antaa	a n t a a
Koistinen	K o i s t i n e n
vasta	v a s t a
paikat	p a i k a t
Oy	O y
otoksen	o t o k s e n
kunnissa	k u n n i s s a
kieleen	k i e l e e n
rakenne	r a k e n n e
suunniteltu	s u u n n i t e l t u
viranomaiset	v i r a n o m a i s e t
manuaali	m a n u a a l i
maksaa	m a k s a a
uusi	u u s i
savuinen	s a v u i n e n
bändi	b ä n d i
hinta	h i n t a
miehittää	m i e h i t t ä ä
etsi	e t s i
joita	j o i t a
virta	v i r t a
kansallinen	k a n s a l l i n e n
syödä	s y ö d ä
lapsi	l a p s i
yliminän	y l i m i n ä n
monista	m o n i s t a
kissan	k i s s a n
suomalaisille	s u o m a l a i s i l l e
vähät	v ä h ä t
erityisen	e r i t y i s e n
pitkin	p i t k i n
keskellä	k e s k e l l ä
vieläkään	v i e l ä k ä ä n
pyöreä	p y ö r e ä
Kalifornian	K a l i f o r n i a n
varten	v a r t e n
tytöt	t y t ö t
nimipäivä	n i m i p ä i v ä
nimesi	n i m e s i
vieläpä	v i e l ä p ä
rooli	r o o l i
sokeritasapaino	s o k e r i t a s a p a i n o
moraalisesti	m o r a a l i s e s t i
apukokki	a p u k o k k i
toiminta	t o i m i n t a
taveja	t a v e j a
tavoittavuus	t a v o i t t a v u u s
tuntia	t u n t i a
kutista	k u t i s t a
ovat	o v a t
maaliin	m a a l i i n
Aimo	A i m o
Pohjois-Savo	P o h j o i s - S a v o
pahempaa	p a h e m p a a
talvella	t a l v e l l a
saa	s a a
Salon	S a l o n
taakka	t a a k k a
tekevät	t e k e v ä t
harmi	h a r m i
metsä	m e t s ä
sähköisesti	s ä h k ö i s e s t i
korkotaso	k o r k o t a s o
säilyttää	s ä i l y t t ä ä
Helsinkiin	H e l s i n k i i n
yllättäjä	y l l ä t t ä j ä
vaihtelua	v a i h t e l u a
elävät	e l ä v ä t
tiedoista	t i e d o i s t a
pommin	p o m m i n
pidämme	p i d ä m m e
voisi	v o i s i
veroja	v e r o j a
pääasiallinen	p ä ä a s i a l l i n e n
voimakkaasti	v o i m a k k a a s t i
lähes	l ä h e s
päivien	p ä i v i e n
kieltänyt	k i e l t ä n y t
tervetuloa	t e r v e t u l o a
hyppäsi	h y p p ä s i
osaisi	o s a i s i
tärkeäksi	t ä r k e ä k s i
muina	m u i n a
niillä	n i i l l ä
pimeässä	p i m e ä s s ä
tutkimus	t u t k i m u s
pienestä	p i e n e s t ä
tarpeen	t a r p e e n
aurinkoinen	a u r i n k o i n e n
väki	v ä k i
muuttuvat	m u u t t u v a t
kodeista	k o d e i s t a
sulttaanikunta	s u l t t a a n i k u n t a
omavarainen	o m a v a r a i n e n
vanhemmilla	v a n h e m m i l l a
nousivat	n o u s i v a t
suosituin	s u o s i t u i n
tiedotustilaisuus	t i e d o t u s t i l a i s u u s
levon	l e v o n
varmaan	v a r m a a n
autokauppa	a u t o k a u p p a
ajetaan	a j e t a a n
yhdessä	y h d e s s ä
tekijä	t e k i j ä
sivusto	s i v u s t o
kulki	k u l k i
ohjeesta	o h j e e s t a
houkutteleva	h o u k u t t e l e v a
osakkeet	o s a k k e e t
hajottaja	h a j o t t a j a
ominaisuudet	o m i n a i s u u d e t
vieraat	v i e r a a t
tuotteen	t u o t t e e n
oikeaan	o i k e a a n
kertoo	k e r t o o
kastike	k a s t i k e
lyhyt	l y h y t
jalkaan	j a l k a a n
saa	s a a
herätysliike	h e r ä t y s l i i k e
antaa	a n t a a
asenteet	a s e n t e e t
listaus	l i s t a u s
huhti	h u h t i
Oy	O y
väkertää	v ä k e r t ä ä
tietyn	t i e t y n
kuorma	k u o r m a
vastauksia	v a s t a u k s i a
yritys	y r i t y s
lompakko	l o m p a k k o
tuottavat	t u o t t a v a t
lukevat	l u k e v a t
Vartiainen	V a r t i a i n e n
matkaan	m a t k a a n
luovuttaminen	l u o v u t t a m i n e n
laskivat	l a s k i v a t
sano	s a n o
uusi	u u s i
tämä	t ä m ä
egon	e g o n
kiertää	k i e r t ä ä
kiinnostava	k i i n n o s t a v a
toiveikas	t o i v e i k a s
risteilijä	r i s t e i l i j ä
osaaminen	o s a a m i n e n
jatketaan	j a t k e t a a n
vähentää	v ä h e n t ä ä
kuinka	k u i n k a
jätetään	j ä t e t ä ä n
alku	a l k u
varten	v a r t e n
sanoma	s a n o m a
nukahtaa	n u k a h t a a
dynaamisesti	d y n a a m i s e s t i
sinivalkoinen	s i n i v a l k o i n e n
viha	v i h a
tämä	t ä m ä
neuvottelee	n e u v o t t e l e e
vaivaa	v a i v a a
ammatin	a m m a t i n
tämän	t ä m ä n
esiintyi	e s i i n t y i
istutus	i s t u t u s
kalaa	k a l a a
tarkoittaa	t a r k o i t t a a
altistus	a l t i s t u s
iloksi	i l o k s i
vei	v e i
päivitys	p ä i v i t y s
johtuen	j o h t u e n
veren	v e r e n
vaikkakin	v a i k k a k i n
nimi	n i m i
ollut	o l l u t
korko	k o r k o
nimitetty	n i m i t e t t y
aamuun	a a m u u n
aion	a i o n
huomattavasti	h u o m a t t a v a s t i
tuomittiin	t u o m i t t i i n
yhteisön	y h t e i s ö n
havaittu	h a v a i t t u
Unkari	U n k a r i
nähdä	n ä h d ä
petsata	p e t s a t a
Nurmijärvi	N u r m i j ä r v i
joulu	j o u l u
vähän	v ä h ä n
mukaan	m u k a a n
etenee	e t e n e e
tietojen	t i e t o j e n
esitelty	e s i t e l t y
identiteetti	i d e n t i t e e t t i
tavoittelee	t a v o i t t e l e e
pienempää	p i e n e m p ä ä
johdosta	j o h d o s t a
saalis	s a a l i s
liekki	l i e k k i
ehkäisy	e h k ä i s y
hinta	h i n t a
hinta	h i n t a
kieltämättä	k i e l t ä m ä t t ä
kiven	k i v e n
riskien	r i s k i e n
käytännön	k ä y t ä n n ö n
joita	j o i t a
esitykset	e s i t y k s e t
vähittäiskaupan	v ä h i t t ä i s k a u p a n
tukikohta	t u k i k o h t a
englanti	e n g l a n t i
tarkoittaa	t a r k o i t t a a
eli	e l i
eniten	e n i t e n
tapahtumiin	t a p a h t u m i i n
hukkalämpö	h u k k a l ä m p ö
haluamme	h a l u a m m e
syntyvät	s y n t y v ä t
yksi	y k s i
jälkeen	j ä l k e e n
taivaalla	t a i v a a l l a
kävimme	k ä v i m m e
epäselvää	e p ä s e l v ä ä
kansan	k a n s a n
ovat	o v a t
pysyy	p y s y y
voimakkaasti	v o i m a k k a a s t i
Turun	T u r u n
julkaistiin	j u l k a i s t i i n
opas	o p a s
lunta	l u n t a
nimi	n i m i
tarkasta	t a r k a s t a
kehityksen	k e h i t y k s e n
paketti	p a k e t t i
kaksi	k a k s i
yleistää	y l e i s t ä ä
linjakas	l i n j a k a s
Oy	O y
syöjä	s y ö j ä
liittovaltion	l i i t t o v a l t i o n
illallinen	i l l a l l i n e n
järjestäjän	j ä r j e s t ä j ä n
ohjelmassa	o h j e l m a s s a
luonnon	l u o n n o n
aksiaalisesti	a k s i a a l i s e s t i
kaksinkertaistuneet	k a k s i n k e r t a i s t u n e e t
asukasluku	a s u k a s l u k u
ylläpito	y l l ä p i t o
Matti	M a t t i
mallikkaasti	m a l l i k k a a s t i
näin	n ä i n
musiikkielämä	m u s i i k k i e l ä m ä
hyvinvointi	h y v i n v o i n t i
suomenkieliset	s u o m e n k i e l i s e t
maansa	m a a n s a
Kyyhkynen	K y y h k y n e n
lääkärit	l ä ä k ä r i t
äänet	ä ä n e t
Laaksonen	L a a k s o n e n
välityspalvelin	v ä l i t y s p a l v e l i n
joten	j o t e n
välissä	v ä l i s s ä
käsittelyn	k ä s i t t e l y n
oleva	o l e v a
astetta	a s t e t t a
revi	r e v i
painoin	p a i n o i n
tuetaan	t u e t a a n
syyskuussa	s y y s k u u s s a
jakoi	j a k o i
pelataan	p e l a t a a n
tarttuminen	t a r t t u m i n e n
litraa	l i t r a a
kuitenkin	k u i t e n k i n
laatimaan	l a a t i m a a n
hurjasti	h u r j a s t i
takaosan	t a k a o s a n
käytössä	k ä y t ö s s ä
ovat	o v a t
selkeästi	s e l k e ä s t i
turistien	t u r i s t i e n
kuitenkin	k u i t e n k i n
glögi	g l ö g i
sähköpostia	s ä h k ö p o s t i a
vähän	v ä h ä n
joten	j o t e n
Annikki	A n n i k k i
opas	o p a s
suvaita	s u v a i t a
pohjaa	p o h j a a
kevyet	k e v y e t
kommunisti	k o m m u n i s t i
mistä	m i s t ä
sunnuntain	s u n n u n t a i n
mojova	m o j o v a
vasta	v a s t a
teräväkielisesti	t e r ä v ä k i e l i s e s t i
sähköpostilla	s ä h k ö p o s t i l l a
nousin	n o u s i n
kopio	k o p i o
mieluiten	m i e l u i t e n
sadan	s a d a n
Räikkönen	R ä i k k ö n e n
nyt	n y t
sanat	s a n a t
yksi	y k s i
tiedote	t i e d o t e
epävarmuus	e p ä v a r m u u s
pohtia	p o h t i a
hitaasti	h i t a a s t i
savessa	s a v e s s a
itkee	i t k e e
korruption	k o r r u p t i o n
