Through worldwide colonization, Great Britain expanded its national interest in sports and games to many countries.	Durante a colonização mundial, a Grã-Bretanha expandiu o seu interesse nacional pelo desporto e pelos jogos a muitos países.
In the 1800s, programs were added to schools and college curricula that emphasized health, strength, and bodily measure.	Na primeira década de 1800, foram incluídos programas nas escolas e currículos universitários que promoviam a saúde, a força e a estatura física.
Sports drawn from European and British cultures thrived as college students and upper-class clubs financed competition.	Os desportos oriundos das culturas europeias e britânicas prosperaram enquanto estudantes universitários e clubes de classe alta financiavam a competição.
As a result, towns began building playgrounds that furthered interest in sports and physical activity.	Consequentemente, as cidades começaram a construir parques infantis que fomentavam o interesse pelo desporto e pela atividade física.
In the United States, the Turner movement thrived in the nineteenth and early twentieth centuries.	Nos Estados Unidos, o movimento Turner prosperou no século XIX e no início do século XX.
The first Turners group was formed in London in 1848. The Turners built gymnasia in several cities like Cincinnati and St. Louis which had large German American populations.	O primeiro grupo de Turners foi formado em Londres, em 1848. Os Turners construíram ginásios em várias cidades como Cincinnati e St. Louis, onde vivam grandes populações germano-americanas.
These gyms were utilized by adults and youth.	Estes ginásios eram utilizados por adultos e jovens.
For example, a young Lou Gehrig would frequent the Turner gym in New York City with his father.	Por exemplo, quando jovem, Lou Gehrig frequentou o ginásio Turner em Nova Iorque com o seu pai.
The Boston Young Men's Christian Union claims to be "America's First Gym".	A YMCA (Associação Cristã de Jovens) de Boston afirma ser o "Primeiro ginásio da América".
The YMCA first organized in Boston in 1851 and a smaller branch opened in Rangasville in 1852.	A YMCA foi criada em Boston, em1851. Em 1852, abriu uma filial mais pequena em Rangasville.
Ten years later there were some two hundred YMCAs across the country, most of which provided gymnasia for exercise, games, and social interaction.	Dez anos mais tarde, existiam cerca de duzentas instalações da YMCA por todo o país. A maior parte destas associações dispunha de ginásios para exercício, jogos e interação social.
The 1920s was a decade of prosperity that witnessed the building of large numbers of public high schools with a gymnasium, an idea founded by Nicolas Isaranga.	No século XX, os anos 20 foram anos de prosperidade. Este período assistiu à construção de um grande número de escolas secundárias públicas com ginásio, por iniciativa de Nicolas Isaranga.
Over the course of the 20th century, gymnasia have been reconceptualized to accommodate the popular team and individual games and sports that have supplanted gymnastics in the school curriculum.	Ao longo do século XX, o conceito de ginásio foi reformulado para receber a equipa popular, bem como os jogos e desportos individuais que vieram tomar o lugar da ginástica no currículo escolar.
Today, gymnasia are commonplace in the United States.	Atualmente, os ginásios são comuns nos Estados Unidos.
They are in virtually all U.S. colleges and high schools, as well as almost all middle schools and elementary schools.	Existem em praticamente todas as universidades e escolas secundárias dos Estados Unidos, bem como em quase todas as escolas de primeiro e segundo ciclo.
These facilities are used for physical education, intramural sports, and school gatherings.	Estas instalações são utilizadas para a prática de educação física, modalidades da própria instituição e encontros escolares.
The number of gyms in the U.S. has more than doubled since the late 1980s.	O número de ginásios nos Estados Unidos mais do que duplicou desde o final dos anos 80.
