Flip-flops are a type of sandal, typically worn as a form of casual wear.	人字拖是一种凉鞋，尤其用于休闲穿搭。
They consist of a flat sole held loosely on the foot by a Y-shaped strap known as a toe thong that passes between the first and second toes and around both sides of the foot or can be a hard base with a strap across all the toes (these can also be called sliders).	它们由平坦的鞋底和松松地挂在脚上的 Y 型带子（又名脚趾带）组成，带子会穿过第一和第二根脚趾，然后延伸至脚的两侧，也可能是由硬鞋底和横跨所有脚趾的带子组成（又称拖鞋）。
This style of footwear has been worn by the people of many cultures throughout the world, originating as early as the ancient Egyptians in 1,500 B.C.	全球各种文化的人们都会穿这种类型的鞋子，这种鞋子最早起源于公元前 1,500 年的古埃及。
In the United States the flip-flop descends from the Japanese zōri, which became popular after World War II as soldiers brought them back from Japan.	在美国，人字拖鞋来源于日本的 zōri。第二次世界大战后士兵将其从日本带回美国，从此流行起来。
They became popular unisex summer footwear starting in the 1960s.	20 世纪 60 年代，它们成为流行的中性夏日鞋款。
The term flip-flop has been used in American and British English since the 1960s to describe the thong or no-heel-strap sandal.	20 世纪 60 年代起，美式英语和英式英语用 flip-flop 一词来描述人字拖鞋或没有跟的有带凉鞋。
It is an onomatopoeia of the sound made by the sandals when walking in them.	这是穿着凉鞋走路时发出的声音的拟声词。
They are called thongs (sometimes pluggers) in Australia, jandals (originally a trademarked name derived from "Japanese sandals") in New Zealand, slops or “visplakkies” in South Africa and Zimbabwe, and tsinelas or step-in in the Philippines (or, in some Visayan localities, "smagol", from the word smuggled).	它们在澳大利亚被称为 thongs（有时也叫 pluggers），在新西兰被称为 jandals（原本是“日本木屐”的品牌名），在南非和津巴布韦被称为 slops 或“visplakkies”，在菲律宾被称为 tsinelas 或 step-in（或在米沙鄢地区被称为“smagol”，来源于 smuggled 一词）。
This footwear has a number of other names around the world.	这种鞋子在全球范围内还有多种名字。
The Japanese wear similarly designed, traditional straw sandals known as zōri.	日本人穿着类似设计的传统草鞋，名为 zōri。
Throughout the world, they are known by a variety of other names, including dép tông or dép xỏ ngón in Vietnam, chinelos in Brazil, japonki in Poland, dacas in Somalia, sayonares (σαγιονάρες) in Greece, slippers in Hawaii, Bahamas, Trinidad and Tobago and the Netherlands, infradito in Italy, djapanki (джапанки) in Bulgaria,"charlie wote" in Ghana, "japanke" in Croatia and vietnamki in Russia and Ukraine, yezenes in Latvia.	在全球范围内，它们还有其他多种名字，包括越南的 dép tông 或 dép xỏ ngón、巴西的 chinelos、波兰的 japonki、索马里的 dacas、希腊的 sayonares (σαγιονάρες)、夏威夷、巴哈马、特立尼达和多巴哥以及荷兰的 slippers、意大利的 infradito、保加利亚的 djapanki (джапанки)、加纳的“charlie wote”、克罗地亚的“japanke”以及俄罗斯和乌克兰的 vietnamki、拉脱维亚的 yezenes。
They were introduced by Bata in India under the brand name Hawaii slippers and are extremely popular throughout the country.	它们由 Bata 引入印度，隶属 Hawaii slippers 品牌旗下，风靡全国。
Thong sandals have been worn for thousands of years, dating back to pictures of them in ancient Egyptian murals from 4,000 BC.	人字拖鞋已有数千年历史，最早可以追溯到公元前 4,000 年的古埃及壁画。
A pair found in Europe was made of papyrus leaves and dated to be approximately 1,500 years old.	在欧洲发现了一双由纸莎草叶子制成的鞋子，已有将近 1,500 年历史。
These early versions of flip-flops were made from a wide variety of materials.	这些早期的人字拖鞋由多种材质制成。
Ancient Egyptian sandals were made from papyrus and palm leaves.	古埃及的凉鞋由纸莎草和棕榈叶制成。
The Masai of Africa made them out of rawhide.	非洲马赛族人用生牛皮制作。
In India, they were made from wood.	在印度，它们由木头制成。
In China and Japan, rice straw was used.	中国人和日本人使用稻草。
The leaves of the sisal plant were used to make twine for sandals in South America, while the natives of Mexico used the yucca plant.	南非人用剑麻的叶子来制作凉鞋的带子，而墨西哥土著使用丝兰。
The Ancient Greeks and Romans wore versions of flip-flops as well.	古埃及人和罗马人也穿不同版本的人字拖鞋。
In Greek sandals, the toe strap was worn between the first and second toes, while Roman sandals had the strap between the second and third toes.	希腊凉鞋的带子穿过第一和第二个脚趾之间，但罗马凉鞋的带子穿过第二和第三个脚趾之间。
These differ from the sandals worn by the Mesopotamians, with the strap between the third and fourth toes.	这些与美索不达米亚人穿的凉鞋不一样，它们的带子穿过第三和第四个脚趾之间。
In India, a related chappal ("toe knob") sandal was common, with no straps but a small knob sitting between the first and second toes.	一种类似的夹趾凉鞋在印度很流行，这种凉鞋没有带子，但在第一和第二个脚趾之间有一个小结。
They are known as Padukas.	它们被称为 Padukas。
The modern flip-flop became popular in the United States as soldiers returning from World War II brought Japanese zōri with them.	美国士兵在第二次世界大战后带回了日本的 zōri，现代人字拖鞋开始在美国流行起来。
It caught on in the 1950s during the postwar boom and after the end of hostilities of the Korean War.	它在 20 世纪 50 年代战后繁荣时期以及朝鲜战争后流行起来。
As they became adopted into American popular culture, the sandals were redesigned and changed into the bright colors that dominated 1950s design.	这种凉鞋逐渐融入美国流行文化，在 20 世纪 50 年代时被重新设计，并采用明亮颜色。
They quickly became popular due to their convenience and comfort, and were popular in beach-themed stores and as summer shoes.	由于其便利性和舒适性，它们迅速流行起来，成为海滩商店的热销鞋款以及人们的夏日首选。
During the 1960s, flip-flops became firmly associated with the beach lifestyle of California.	20 世纪 60 年代，人字拖鞋与加利福尼亚的海滩生活紧密联系起来。
As such, they were promoted as primarily a casual accessory, typically worn with shorts, bathing suits, or summer dresses.	因此，它们被营销为一种休闲配饰，用于搭配短裤、游泳衣或夏日裙子。
As they became more popular, some people started wearing them for dressier or more formal occasions.	由于它们越来越流行，有的人开始在衣着更讲究或更正式的场合穿着它们。
In 1962, Alpargatas marketed a version of flip-flops known as Havaianas in Brazil.	1962 年，Alpargatas 开始在巴西推销一款名为哈瓦那的人字拖鞋。
By 2010, more than 150 million pairs of Havaianas were produced each year.	到 2010 年为止，每年都要生产超过 1.5 亿双哈瓦那拖鞋。
Flip-flops quickly became popular as casual footwear of young adults.	人字拖鞋迅速成为受年轻人欢迎的休闲鞋款。
Girls would often decorate their flip-flops with metallic finishes, charms, chains, beads, rhinestones, or other jewelry.	女孩们会用金属饰品、挂饰、链条、珠子、莱茵石或其他宝石来装饰人字拖鞋。
High-end flip-flops made of leather or sophisticated synthetic materials are commonly worn in place of sneakers or loafers as the standard, everyday article of casual footwear, particularly among teenagers and young adults, although it is not unusual to see older people wearing playful, thick-soled flip-flops in brilliant colors.	皮制或复杂合成材料制成的高端人字拖鞋通常会替代运动鞋或乐福鞋作为每天标准的休闲鞋款使用，特别是青少年和年轻人，但也很常见年纪较大的人穿着亮色的厚底人字拖鞋。
Platform and high-heel variants began to appear in the 1990s.	20 世纪 90 年代，开始出现厚底和高跟的款式。
A minor controversy erupted in 2005 when some members of Northwestern University's national champion women's lacrosse team visited the White House wearing flip-flops.	2005 年时发生了一起小争议，当时西北大学国家冠军女子长曲棍球队的部分队员在参观白宫时穿了人字拖鞋。
The team responded to critics by auctioning off their flip-flops on eBay, raising $1,653 USD for young cancer patient, Jaclyn Murphy of Hopewell Junction, New York, who was befriended by the team.	面对批评的言论，该团队将他们的人字拖鞋放在 eBay 上拍卖，为来自纽约 Hopewell Junction 的年轻癌症患者贾克琳·墨菲筹集了 1,653 美元，她也是这个团队的朋友。
There is still a debate over whether this signaled a fundamental change in American culture — many youth feel that flip-flops are dressier and can be worn in a variety of social contexts, while older generations feel that wearing them at formal occasions signifies laziness and comfort over style.	人们仍在争论这是否代表着美国文化发生彻底变化。许多年轻人认为人字拖鞋也比较正式，可以在多种社交场合穿着，但老一代认为在正式场合穿人字拖鞋意味着懒惰和过于舒适。
In 2011, while vacationing in his native Hawaii, Barack Obama became the first President of the United States to be photographed wearing a pair of flip-flops.	2011 年，贝拉克·奥巴马在出生地夏威夷度假时，成为第一位被拍到穿着人字拖鞋的美国总统。
The Dalai Lama of Tibet is also a frequent wearer of flip-flops and has met with several U.S. presidents, including George W. Bush and Barack Obama, while wearing the sandals.	西藏的达赖喇嘛也很常穿人字拖鞋，在与包括乔治·布什和贝拉克·奥巴马在内的多位美国总统会面时都穿着凉鞋。
While exact sales figures for flip-flops are difficult to obtain due to the large number of stores and manufacturers involved, the Atlanta-based company Flip Flop Shops claimed that the shoes were responsible for a $20 billion industry in 2009.	虽然由于商店和厂家的数量庞大，很难获得确切的人字拖鞋销售数据，但在 2009 年，一家总部在亚特兰大的公司 Flip Flop Shops 声称人字拖鞋带来了 200 亿美元的收益。
Furthermore, sales of flip-flops exceeded those of sneakers for the first time in 2006.	2006 年，人字拖鞋的销量甚至首次超过了运动鞋的销量。
If these figures are accurate, it is remarkable considering the low cost of most flip-flops.	如果这些数据是准确的，考虑到大部分人字拖鞋的成本很低，这是个惊人的事实。
The modern flip-flop has a very simple design, consisting of a thin rubber sole with two straps running in a Y shape from the sides of the foot to the gap between the big toe and the one beside it.	现代人字拖鞋设计简约，包括薄的橡胶鞋底和两条 Y 型带子，带子从脚的两侧一直延伸至大脚趾和第二个脚趾之间。
They typically do not have a strap around the heel, although heeled varieties are available, as well as flip-flops designed for sports, which come with added support common to athletic shoes, with the thong between the toes.	虽然有高跟的版本，但通常跟部没有带子。此外也有专为运动设计的人字拖鞋，带有运动鞋常见的附加支撑以及脚趾处的人型带子。
Most modern flip-flops are inexpensive, costing as little as $5 USD, or less in some parts of the world.	大部分现代人字拖鞋价格便宜，只需 5 美元，在部分地区价格甚至更低。
They are made from a wide variety of materials, as were the ancient thong sandals.	与老式人字拖鞋一样，它们也由多种材料制成。
The modern sandals are made of more modern materials, such as rubber, foam, plastic, leather, suede, and even fabric.	现代凉鞋会由更现代的材料制成，包括橡胶、海绵、塑料、皮革、绒面革，甚至还有布料。
Thongs made of polyurethane have caused some environmental concerns; because polyurethane is a number 7 resin, they can't be easily discarded, and they persist in landfills for a very long time.	聚氨酯制成的人字拖鞋引发了一些对环境的担忧，因为聚氨酯是 7 号树脂，难以分解，会在垃圾填埋场保存很长一段时间。
In response to these concerns, some companies have begun selling flip-flops made from recycled rubber, such as that from used bicycle tires, or even hemp, and some offer a recycling program for used flip flops.	为了回应这些担忧，有的公司开始销售用可回收橡胶（例如从自行车旧轮胎上回收的）或大麻制成的人字拖鞋，有的公司为旧的人字拖鞋提供回收计划。
Because of the strap between the toes, flip-flops are typically not worn with socks.	由于脚趾中间有带子，人字拖鞋通常不会搭配袜子穿着。
In colder weather, however, some people wear flip-flops with toe socks.	但是天气冷的时候，有的人会用分趾袜搭配人字拖。
The Japanese commonly wear tabi, a type of sock with a single slot for the thong, with their zōri.	日本人通常会穿足袋，这是专为 zōri 设计的分趾袜子。
While flip-flops do provide the wearer with some mild protection from hazards on the ground, such as hot sand at the beach, glass, thumb tacks or even fungi and wart-causing viruses in locker rooms or community pools, their simple design is responsible for a host of other injuries of the foot and lower leg.	虽然人字拖鞋确实能为穿着者提供轻微防护，免受地面隐患危害，例如沙滩的热沙、玻璃、图钉，甚至还可以在更衣室或社区游泳池里避免感染真菌或导致疣的病毒，但其简单的设计可以回导致脚部和小腿遭受其它伤害。
Walking for long periods in flip-flops can be very tough on the feet, resulting in pain in the ankles, legs, and feet.	长时间穿着人字拖鞋走路对脚非常不好，可能会导致脚踝、腿部和脚部疼痛。
A 2009 study at Auburn University found that flip-flop wearers took shorter steps and their heels hit the ground with less vertical force than those wearing athletic shoes.	奥本大学 2009 年的研究发现，与运动鞋穿着者相比，人字拖鞋穿着者步伐更小，鞋跟碰地时垂直方向的力量更小。
Individuals with flat feet or other foot issues are advised to wear a shoe with better support.	患有扁平足或其他足部问题的个人建议穿支撑力更好的鞋子。
The lack of support provided by thong sandals is thought by some to be a major cause of injuries.	有的人认为由于人字拖鞋缺乏支撑力，更容易造成伤害。
Some flip-flops have a spongy sole, causing the foot to roll further inward than normal when it hits the ground (over-pronation).	有的人字拖鞋鞋底柔软，导致足部在落地时比平常更向内卷（足外翻）。
Flip-flops can cause a person to overuse the tendons in their feet, resulting in tendonitis.	人字拖鞋会导致足部肌腱使用过度，最终造成肌腱炎。
Ankle sprains or broken bones are also common injuries, due to stepping off a curb or tumbling; the ankle bends, but the flip-flop neither holds on to nor supports it.	由于走下路缘或摔倒，很容易造成脚踝扭伤或骨头断裂；脚踝弯曲时，人字拖鞋不跟脚或无法支撑它。
The straps of the flip-flop may cause frictional issues, such as rubbing, during walking.	走路时，人字拖鞋的带子可能会导致摩擦问题，例如磨脚。
The open-toed nature of the thongs may result in cuts, scrapes, bruises, or stubbed toes.	由于人字拖鞋无法包裹脚趾，可能会造成割伤、划伤、瘀伤或踢到脚趾。
Despite all of these issues, flip-flops do not have to be avoided completely.	尽管有这些问题存在，但没有必要完全避免穿着人字拖鞋。
Many podiatrists recommend avoiding the inexpensive, drug store varieties and spending more on sandals with thick-cushioned soles, as well as ones that have a strap that's not canvas and that comes back almost to the ankle.	许多足科医生建议避免在药妆店购买平价凉鞋，应该花多点钱购买有厚底的凉鞋以及带子材质不是帆布并且覆盖面接近脚踝的凉鞋。
A paper clip (or sometimes paperclip) is a device used to hold sheets of paper together, usually made of steel wire bent to a looped shape (though some are covered in plastic).	回形针是用来固定多张纸张的工具，通常用钢丝制成，弯成环形（有的表面会用塑料覆盖）。
Most paper clips are variations of the Gem type introduced in the 1890s or earlier, characterized by the almost two full loops made by the wire.	大多数回形针的原型都是 19 世纪 90 年代或更早出现的宝石型回形针，其特点是钢丝被弯成了两个几乎完整的圆形。
Common to paper clips proper is their utilization of torsion and elasticity in the wire, and friction between wire and paper.	回形针的原理是利用了钢丝的可弯曲性和弹性，以及钢丝和纸张之间的摩擦力。
When a moderate number of sheets are inserted between the two "tongues" of the clip, the tongues will be forced apart and cause torsion in the bend of the wire to grip the sheets together.	当在回形针两“舌”之间插入合适数量的纸张时，回形针的两舌会被分开，发生弯曲，并将纸张固定在一起。
Paper clips usually have an oblong shape with straight sides, but may also be triangular or circular, or have more elaborate shapes.	回形针的形状通常是有直边的椭圆形，但也可能是三角形或圆形，或是更复杂的形状。
The most common material is steel or some other metal, but moulded plastic is also used.	最常用的材料是钢或其他金属，但也会使用模压塑料。
Some other kinds of paper clip use a two-piece clamping system.	有些其他类型的回形针会使用两片夹紧的结构。
Recent innovations include multi-colored plastic-coated paper clips and spring-fastened binder clips.	最新的创新产品包括多彩涂塑回形针和弹簧装订夹。
According to the Early Office Museum, the first patent for a bent wire paper clip was awarded in the United States to Samuel B. Fay in 1867.	根据早期办公室博物馆，首个弯曲钢丝回形针的专利于 1867 年在美国颁给了塞缪尔·B·费伊。
This clip was originally intended primarily for attaching tickets to fabric, although the patent recognized that it could be used to attach papers together.	虽然专利认可回形针可以用来把纸张固定在一起，但这种回形针最早用于将标签固定在布料上。
Fay received U.S. patent 64,088 on April 23, 1867.	1867 年 4 月 23 日，费伊收到了美国专利 64,088 号。
Although functional and practical, Fay's design along with the 50 other designs patented prior to 1899 are not considered reminiscent of the modern paperclip design known today.	虽然这些设计很实用，但费伊的设计以及 1899 年以前取得专利的其他 50 种设计都不会让人联想起今天的现代回形针设计。
Another notable paper clip design was also patented in the United States by Erlman J. Wright in 1877.	另一种著名的回形针设计也是由艾尔曼·J·赖特于 1877 年在美国获得专利。
This clip was advertised at that time for use in fastening newspapers.	当时的广告宣传称这种回形针可用于固定报纸。
The most common type of wire paper clip still in use, the Gem paper clip, was never patented, but it was most likely in production in Britain in the early 1870s by "The Gem Manufacturing Company", according to the American expert on technological innovations, Professor Henry J. Petroski.	研究科技创新的美国专家亨利·J·彼得罗斯基教授表示，宝石型回形针是如今仍在使用的最常见的钢丝回形针类型，从未获得专利，但最可能是由“The Gem Manufacturing Company”于 19 世纪 70 年代在英国生产的。
He refers to an 1883 article about "Gem Paper-Fasteners", praising them for being "better than ordinary pins" for "binding together papers on the same subject, a bundle of letters, or pages of a manuscript".	他提到了 1883 年有关“宝石纸张固定器”的文章，赞扬它们在“同一个物体上固定纸张、固定一堆信件或多页手稿”时“比普通别针更好用”。
Since the 1883 article had no illustration of this early "Gem", it may have been different from modern paper clips of that name.	由于 1883 年的文章中没有附上早期“宝石”的图片，可能会与现代同名回形针有所不同。
The earliest illustration of its current form is in an 1893 advertisement for the "Gem Paper Clip".	它现在形态最早的图片出现在 1893 年“宝石回形针”的广告中。
In 1904 Cushman & Denison registered a trademark for the "Gem" name in connection with paper clips.	1904 年，Cushman & Denison 为回形针注册了“宝石”这个名字的商标。
The announcement stated that it had been used since March 1, 1892, which may have been the time of its introduction in the United States.	公告表示它自 1892 年 3 月 1 日开始使用，这可能是引入美国的时间。
Paper clips are still sometimes called "Gem clips", and in Swedish the word for any paper clip is "gem".	回形针有时仍被称为“宝石针”，瑞典语用“gem”表示所有类型的回形针。
Definite proof that the modern type of paper clip was well known in 1899 at the latest, is the patent granted to William Middlebrook of Waterbury, Connecticut on April 27 of that year for a "Machine for making wire paper clips." The drawing clearly shows that the product is a perfect clip of the Gem type.	现代回形针的确切证据可以追溯到最近的 1899 年。在那一年的 4 月 27 日，康涅狄格州沃特伯里的威廉·米德尔布鲁克因“制作钢丝回形针的机器”获得了专利。图片清晰显示了那个回形针恰好是宝石型的回形针。
The fact that Middlebrook did not mention it by name, suggests that it was already well known at the time.	米德尔布鲁克没有以自己的名字来命名，这说明当时它已经很出名了。
Since then countless variations on the same theme have been patented.	从那以后，同个物品的无数变体获得了专利。
Some have pointed instead of rounded ends, some have the end of one loop bent slightly to make it easier to insert sheets of paper, and some have wires with undulations or barbs to get a better grip.	有的是尖头的而不是圆头的；有的尾部的圆环会微微弯曲，更容易插入纸张；有的钢丝上有凸起或小勾，能起到更好的固定作用。
In addition, purely aesthetic variants have been patented, clips with triangular, star, or round shapes.	此外，纯美观的版本也获得了专利，例如三角形、星形或圆形的回形针。
But the original Gem type has for more than a hundred years proved to be the most practical, and consequently by far the most popular.	但是拥有一百年历史的原始宝石型是最实用的，因此也最受欢迎。
Its qualities—ease of use, gripping without tearing, and storing without tangling—have been difficult to improve upon.	它的品质（容易使用、固定却不会拉扯以及有序存放）已经达到最佳水平。
National Paperclip Day is May 29.	国际回形针日是 5 月 29 日。
It has been claimed, though apparently without evidence, that Herbert Spencer, the originator of the term "survival of the fittest", invented the paper clip.	虽然明显没有证据，但据称“适者生存”一词的创始人赫伯特·斯宾塞发明了回形针。
Spencer claimed in his autobiography to have invented a "binding-pin" that was distributed by Ackermann & Company, and he shows a drawing of the pin in his Appendix I (following Appendix H).	斯宾塞在自传中声称他发明了一种“装订别针”，由 Ackermann & Company 进行分销，他还在附录 I（以下附录 H）中展示了这种别针的图片。
This pin looked more like a modern cotter pin than a modern paper clip, but it was designed to hold sheets of paper together.	这种别针看起来更像今天的开口销，而不是今天的回形针，但它的确用于固定纸张。
It is approximately 15 cm unfolded.	它展开大约长 15 厘米。
A Norwegian, Johan Vaaler (1866–1910), has erroneously been identified as the inventor of the paper clip.	挪威人约翰·瓦勒（1866—1910）被错认为回形针的发明者。
He was granted patents in Germany and in the United States (1901) for a paper clip of similar design, but less functional and practical, because it lacked the last turn of the wire.	他的类似设计的回形针在德国和美国（1901）获得了专利，但这种回形针没那么实用，因为钢丝的最后部分没有弯曲。
